"site_code","lessee_name","lessee_company","lessee_DBA","address_zip","lease_record_type","lease_description","lease_status","lease_location_name","nonprofit_lessee","date_effective","date_sched_termination","rent_code","cost_line_amt_USD"
"R402RD","MORLEY FIELD DGC, LLC","MORLEY FIELD DGC, LLC","","92101-7243","Lease","DISC GOLF COURSE","Normal","PERSHING DR & JACARANDA PL, MORLEY FIELD","0.0","9/1/2017","8/31/2027","FMR","100.5"
"R402RD","MUSEUM OF PHOTOGRAPHIC ARTS, INC","MUSEUM OF PHOTOGRAPHIC ARTS, INC","","92101","Agreement","PHOTOGRAPHIC MUSEUM","Extended","1649 EL PRADO, BALBOA PARK","1.0","3/24/1981","3/23/2031","",""
"R402RD","NEW CINGULAR WIRELESS/BALBOA PARK GOL","NEW CINGULAR WIRELESS PCS LLC/BALBOA PARK GOLF COURSE","","30319","Lease","COMMUNICATIONS EQUIPMENT","Held Over","2600 GOLF COURSE DR.","0.0","6/1/2015","5/31/2025","FYD","53602.75"
"R402RD","OLD GLOBE THEATRE/01","OLD GLOBE THEATRE/01","","92112-2171","Lease","THEATRICAL PERFORMANCES","Extended","1363 OLD GLOBE WAY","1.0","4/2/1984","8/19/2029","FYD","4670.0"
"R402RD","OLD GLOBE THEATRE/02","OLD GLOBE THEATRE/02","","92112-2171","Lease","REHEARSAL AND CONCESSIONS","Extended","1439 EL PRADO","1.0","5/28/1996","5/27/2046","",""
"R402RD","PROPHET WORLD BEAT PRODUCTIONS, INC.","PROPHET WORLD BEAT PRODUCTIONS, INC.","","92101","Permit","MUSEUM/ CULTURAL INSTITUTION","Normal","2100 PARK BLVD. SD, CA 92101","1.0","8/6/2024","8/5/2049","FYD","4670.0"
"R402RD","PUTNAM FOUNDATION INC","TIMKEN MUSEUM OF ART","","92103-6624","Agreement","ART MUSEUM","Normal","1500 EL PRADO, BALBOA PARK","1.0","6/20/2019","6/19/2039","FYD","4670.0"
"R402RD","SD AIR & SPACE MUSEUM","SD AIR & SPACE MUSEUM","SAN DIEGO AEROSPACE MUSEUM","92101","Lease","AEROSPACE MUSEUM","Extended","2001 PAN AMERICAN PLAZA","1.0","5/1/1986","4/30/2036","",""
"R402RD","SD ART INSTITUTE","SD ART INSTITUTE","","92101-1617","Lease","ART MUSEUM","Extended","1439 EL PRADO, BALBOA PARK","1.0","5/28/1996","5/27/2046","",""
"R402RD","SD AUTOMOTIVE MUSEUM INC","SD AUTOMOTIVE MUSEUM INC","","92101","Lease","AUTOMOBILE MUSEUM","Extended","2080 PAN AMERICAN PLAZA","1.0","1/15/1988","1/14/2038","",""
"R402RD","SD AUTOMOTIVE MUSEUM INC/02","SD AUTOMOTIVE MUSEUM INC/02","","92101","Permit","TEMPORARY OUTDOOR EVENTS VENUE","Normal","2080 PAN AMERICAN PLAZA","1.0","10/22/2025","10/21/2026","FYD","4833.45"
"R402RD","SD COMIC CONVENTION","SD COMIC-CON MUSEUM","","92101","Lease","COMIC-CON CENTER FOR POPULAR CULTURE","Normal","2131 PAN AMERICAN PLAZA, BALBOA PARK","1.0","7/1/1999","5/31/2054","",""
"R402RD","SD COMM COLLEGE DIST/09 (MORLEY FIELD)","SD COMM COLLEGE DIST/09 (MORLEY FIELD)","","92108","Permit","BASEBALL PROGRAM","Held Over","JACARANDA DRIVE, MORLEY FIELD","0.0","3/1/2020","2/28/2023","",""
"R402RD","SD HISTORICAL SOCIETY","SD HISTORICAL SOCIETY","","92101","Agreement","HISTORICAL MUSEUM","Extended","1649 EL PRADO, BALBOA PARK","1.0","3/24/1981","3/23/2031","",""
"R402RD","SD MODEL RAILROAD MUSEUM","SD MODEL RAILROAD MUSEUM","","92101","Lease","MODEL TRAIN MUSEUM","Extended","1649 EL PRADO, BALBOA PARK","1.0","3/24/1981","3/23/2031","",""
"R402RD","SD MUSEUM OF ART","SD MUSEUM OF ART","","92101","Lease","ART MUSEUM","Extended","1450 EL PRADO, BALBOA PARK","1.0","3/1/1990","2/28/2040","",""
"R402RD","SD MUSEUM OF MAN","SD MUSEUM OF MAN","","92101-1681","Agreement","ANTHROPOLOGICAL MUSEUM","Extended","1350 EL PRADO, BALBOA PARK","1.0","7/1/1987","6/30/2037","",""
"R402RD","SD SOCIETY OF NATURAL HISTORY","SD SOCIETY OF NATURAL HISTORY","SD NATURAL HISTORY MUSEUM","92101","Lease","NATURAL HISTORY MUSEUM","Normal","1788 EL PRADO, BALBOA PARK","1.0","12/1/1998","11/30/2033","",""
"R402RD","SD SPACE & SCIENCE FOUNDATION","SD SPACE & SCIENCE FOUNDATION","REUBEN H. FLEET SCIENCE CENTER","92101","Lease","SPACE THEATER","Normal","1875 EL PRADO, BALBOA PARK","1.0","9/1/1996","8/31/2031","",""
"R402RD","SD UNIFIED SCHOOL DIST/01","SD UNIFIED SCHOOL DIST/01","","92111","Lease","SAN DIEGO HIGH SCHOOL & STADIUM","Normal","1405 PARK BLVD. SD, CA 92101","0.0","5/23/2024","5/22/2123","",""
"R402RD","SD UNIFIED SCHOOL DIST/02","SD UNIFIED SCHOOL DIST/02","","92103","Lease","AUDITORIUM","Held Over","NW CORNER PK BLVD-ZOO DR.;3366 PARK BLVD","0.0","10/31/1974","10/30/2024","",""
"R402RD","T-MOBILE USA/01","T-MOBILE USA/01","","98006","Sublease","TELECOMMUNICATIONS ANTENNAS","Held Over","2920 ZOO DRIVE, SAN DIEGO ZOO","0.0","5/22/1996","5/21/2011","FMD","4949.84"
"R402RD","TOBEY, STEVE & CHRISTOPHER","TOBEY, STEVE & CHRISTOPHER","","80138","Lease","RESTAURANT","Held Over","2600 GOLF COURSE DR., BALBOA PARK","0.0","9/6/2019","9/5/2022","FMR","214.0"
"R402RD","UNITED NATIONS ASSOCIATION OF SD","UNITED NATIONS ASSOCIATION OF SD","","92101","Lease","OFFICE, GIFT SHOP","Held Over","PAN-AMERICAN PL., BLDG. 644, BALBOA PARK","1.0","11/1/1996","10/31/2001","FYD","4827.5"
"R402RD","US NAVY/05","US NAVY/05","","92132-5190","Permit","HOSPITAL PARKING","MTM","INSPIRATION POINT, BALBOA PARK","0.0","4/1/1992","","",""
"R402RD","VERIZON NSB BALBOA PARK (GLDN HILL REC CENTER)","VERIZON NSB BALBOA PARK (GLDN HILL REC CENTER)","","92029","License","NSB CARRIER ID: PLATINUM HILL","Pending","ADJACENT TO GOLDEN HILL REC CENTER","0.0","7/1/2026","","",""
"R402RD","VETERANS MEMORIAL CENTER, INC.","VETERANS MEMORIAL CENTER, INC.","","92101-4792","Lease","VETERANS' CENTER","Extended","2115 PARK BOULEVARD (NAVAL CHAPEL)","1.0","2/1/1992","1/31/2042","",""
"R402RD","ZOOLOGICAL SOCIETY OF SD/04","ZOOLOGICAL SOCIETY OF SD/04","SD ZOO","92103","Lease","ZOOLOGICAL GARDENS","Normal","2920 ZOO DRIVE, BALBOA PARK","1.0","7/23/1979","7/23/2034","",""
"R402RD","ZOOLOGICAL SOCIETY OF SD/06","ZOOLOGICAL SOCIETY OF SD/06","BALBOA PARK RAILROAD","92103","Lease","MINIATURE TRAIN","Held Over","VILLAGE PLACE, BALBOA PARK","1.0","10/1/1998","9/30/2001","PMR","30000.0"
"R415PM","PIONEER HOOK & LADDER CO.","PIONEER HOOK & LADDER CO.","","92101-2913","Lease","FIREHOUSE MUSEUM","Normal","1572 COLUMBIA STREET","1.0","6/3/2025","6/2/2035","FYD","4670.0"
"R503RD","VERIZON WIRELESS/MONTCLAIR PARK ","VERIZON WIRELESS (VAW) LLC","","07921","Lease","COMMUNICATIONS EQUIPMENT","Normal","2911 NILE ST, SD, CA 92104","0.0","12/1/2019","11/30/2029","FYD","46711.7"
"R606G1","City--Chollas Operations Station","","","","City Use","","MTM","Chollas Operations Station","0.0","","","FMD","58680.14"
"R606HM","OLIVEWOOD HOUSING PARTNERS, LP","OLIVEWOOD HOUSING","","95816-4734","Lease","LOW-INCOME APARTMENTS","Normal","2855-85 55TH STREET","0.0","10/9/2015","10/31/2056","PYR","0.0"
"R606RS","CHOLLAS RC FLYERS","CHOLLAS RC FLYERS","","92083","Permit","FLYING RADIO-CONTROLLED AIRCRAFT","Held Over","CHOLLAS P&R SOUTH OF COLLEGE GROVE DR.","1.0","9/1/2019","8/31/2022","FSD","2335.0"
"R642PM","CITY HEIGHTS TOWN COUNCIL, INC","","","","Permit","COMMUNITY GARDEN ","Held Over","NE CORNER  OF RIDGEVIEW DR & FAIRMOUNT AVE. SAN DIEGO, CA 92105","1.0","6/1/2021","5/31/2024","",""
"S201RD","CORBIN, GARTH & ALICE","CORBIN, GARTH & ALICE","","92102","House Rental","SINGLE-FAMILY RESIDENCE","MTM","4101 LOMALAND DR. #1., SD 92107","0.0","12/21/1992","","FMD","1954.68"
"S201RD","CORR, JOSEPH","CORR, JOSEPH","","92106","House Rental","SINGLE-FAMILY RESIDENCE","MTM","4101 LOMALAND DR., #3, SD, 92107","0.0","7/17/1995","","FMD","1921.7"
"S201RD","MCINTYRE, SHAYNE & SHANNON P.","MCINTYRE, SHAYNE & SHANNON P.","","92106","House Rental","SINGLE-FAMILY RESIDENCE","MTM","4101 LOMALAND DR., #4, SD 92107","0.0","1/4/1996","","FMD","781.87"
"S201RD","MINOR, TOM & JENNIE","MINOR, TOM & JENNIE","","92107","House Rental","SINGLE FAMILY RESIDENCE","MTM","4515 LADERA STREET, S.D. 92107","0.0","8/1/1995","","FMD","2932.05"
"S201RD","POINT LOMA NAZARENE COLLEGE","PASADENA COLLEGE","","92106","Permit","ACCESS ROAD","Normal","WESTERN LOOP ROAD, POINT LOMA","0.0","8/1/2017","10/31/2044","",""
"S203WM","CELLCO PARTNERSHIP/CATALINA STANDPIPE","VERIZON WIRELESS-CATALINA SP","","07921","Lease","COMMUNICATIONS EQUIPMENT","Normal","209 CATALINA BLVD SD, CA","0.0","11/1/2018","10/31/2028","FYD","53090.03"
"S203WM","SD METROPOLITAN TRANSIT SYSTEM","SD METROPOLITAN TRANSIT SYSTEM","MTS","92101-7490","Agreement","COMMUNICATION FACILITY","Held Over","CATALINA STANDPIPE - 200 CATALINA BLVD","0.0","3/24/2009","3/31/2019","FYD","58437.01"
"S203WM","SDG&E/17","SDG&E/17","","92123","Agreement","COMMUNICATIONS FACILITY","Held Over","CATALINA BLVD/MILLS ST. - PT. LOMA","0.0","3/16/2009","3/15/2019","FYD","19397.11"
"S405RS","SD PERFORMING ARTS LEAGUE","SD PERFORMING ARTS LEAGUE","","92101","Lease","SALES OFFICE FOR EVENT TICKETS","Normal","199 HORTON PLAZA (FSU 4)","1.0","3/29/2016","5/31/2026","",""
"S405RS","STOCKDALE ACQUISITIONS LLC","STOCKDALE ACQUISITIONS LLC","","92101","Agreement","HORTON PLAZA URBAN PARK","Normal","HORTON PLAZA URBAN PARK, 199 HORTON PLAZA APN: 533-610-23","0.0","2/3/2014","5/3/2041","",""
"S408GM","City Administration Bldg","","","","City Use","City-owned building","MTM","CAB","0.0","","","",""
"S408P1","SD THEATRES, INC","SD THEATRES, INC","","92101","Lease","THEATRE","Normal","1100 THIRD AVE, SAN DIEGO, CA ","1.0","3/1/2013","2/28/2063","FMR","0.0"
"S408P2","CA COAST CREDIT UNION","CA COAST CREDIT UNION","","92150-2080","Permit","ATM LOCATION","Normal","SD COMMUNITY CONCOURSE, 202 C ST. SD, CA 92101","0.0","7/16/2024","7/15/2027","FMD","450.0"
"S408P2","CITY--PUBLISHING SERVICES","COMMUNICATIONS - PUBLISHING SERVICES DIVISION ","","92101","MOU","PUBLISHING OPERATIONS  ","Extended","PORTION OF PLAZA HALL-SD CONCOURSE","0.0","3/1/2019","7/31/2026","FQD","12113.04"
"S408P4","CIVIC CENTER CAFE","CIVIC CENTER CAFE","","92101-4105","Sublease","CAFE/ DELI","Extended","CCP 1200 THIRD AVE, STE 408 ","0.0","5/1/2021","4/30/2027","FMD","1051.48"
"S408P4","SOTO, PETE","SOTO, PETE","","92176-6308","Lease","MOBILE HOT DOG VENDING CART","Normal","1200 THIRD AVE CCP PLAZA CT","0.0","10/15/2021","10/14/2027","FMD","583.5"
"S410-001","City--City Operations Building","","","","City Use","City-owned building. Headcounts as of 11/11Building at capacityFS #1 28, 571 sf 25 firefighters","MTM","COB","0.0","","","",""
"S410GM","SDCC NORTH BLOCK LLC","SDCC NORTH BLOCK LLC","","98660-3536","License","CRANE","Normal","1222 FIRST AVE","0.0","5/12/2023","12/31/2026","",""
"S425RS","GASLAMP QUARTER HISTORICAL FOUNDATION","GASLAMP QUARTER HISTORICAL FOUNDATION","WILLIAM HEATH DAVIS HOUSE","92101-6925","Lease","MUSEUM","Held Over","410 ISLAND AVENUE","1.0","8/1/2002","7/31/2007","FMD","389.17"
"S436LB","SD UNIFIED SCHOOL DISTRICT/06","SD UNIFIED SCHOOL DISTRICT","","92103","Lease","PUBLIC CHARTER SCHOOL","Normal","330 PARK BLVD, CENTRAL LIBRARY","0.0","4/28/2010","4/27/2050","",""
"S439CS","AMERICAN MESSAGING SERVICES/03","AMERICAN MESSAGING SERVICES/03","","75057","Permit","COMMUNICATIONS EQUIPMENT","Held Over","1401 BROADWAY","0.0","12/17/2017","7/31/2021","",""
"S439CS","CA COAST CREDIT UNION/02","CALIFORNIA COAST CREDIT UNION","","92150-2080","Permit","ATM MACHINE","Normal","1401 BROADWAY SD, CA 92101","0.0","7/16/2024","7/15/2027","",""
"S452RS","DOWNTOWN SD PUBLIC SPACES FOUNDATION","DOWNTOWN SD PUBLIC SPACES FOUNDATION","","92101","Lease","PORTION OF CHILDREN’S PARK","Normal","401 B ST. STE 100","0.0","9/1/2025","8/30/2035","FMD","378.18"
"S453HM","DOWNTOWN SD PARTNERSHIP FOUNDATION INC","DOWNTOWN SD PARTNERSHIP FOUNDATION ","","92101","License","OFFICE","Normal","1401 IMPERIAL AVE","0.0","9/8/2025","9/7/2028","",""
"S453HM","FAMILY HEALTH CENTERS OF SD/04","FAMILY HEATH CENTERS OF SD","","92102","Lease","HOMELESS NAVIGATION CENTER","MTM","1401 IMPERIAL AVE","0.0","3/4/2019","6/30/2027","",""
"S502PM","BROTHERS UNITED SD FIRE FIGHTERS, INC.","BROTHERS UNITED SD FIRE FIGHTERS, INC.","","92113-1630","Lease","MUSEUM","Held Over","3601 OCEAN VIEW BOULEVARD","1.0","10/1/1986","9/30/2006","FMD","389.17"
"S504R1","BOYS & GIRLS CLUBS OF GREATER SD/01","BOYS & GIRLS CLUBS OF GREATER SAN DIEGO","","92113","Lease","BOYS & GIRLS CLUB","Normal","2930 MARCY AVE., SD, CA ","1.0","2/11/2005","2/28/2030","FMR","3037.5"
"S504RD","SD UNIFIED SCHOOL DISTRICT/05","SD UNIFIED SCHOOL DISTRICT","","92103","Lease","Recreational Facilities","Normal","PORTION OF PROPERTY @ 2850 LOGAN AVE","0.0","6/21/2010","6/20/2060","",""
"S508PM","SHERMAN HEIGHTS COMMUNITY CENTER CORP","SHERMAN HEIGHTS COMMUNITY CENTER CORP","","92102","Lease","COMMUNITY CENTER","Held Over","2260 ISLAND AVENUE","1.0","8/1/1992","7/31/2022","",""
"S509RS","CHICANO PARK MUSEUM & CULTURAL CENTER","CHICANO PARK MUSEUM & CULTURAL CENTER","","92113-2113","Lease","OFFICE, MUSEUM, CULTURAL CENTER & COMMUNITY CENTER","Extended","1960 NATIONAL AVE SD CA 92113 ","1.0","9/7/2018","9/06/2040","FYD","4670.0"
"S511PM","BLACK CONTRACTORS ASSOCIATION","BLACK CONTRACTORS ASSOCIATION","","92114-4213","Lease","HOUSING","Held Over","904 33rd ST","0.0","4/1/2022","3/31/2025","FQD","280.0"
"S587FS","T-MOBILE WEST LLC/FIRE 19","T-MOBILE WEST LLC/FIRE","T-MOBILE WEST CORPORATION","98006","Lease","TELECOM FACILITY","Held Over","3434 OCEAN VIEW BLVD. (SD06496A)","0.0","6/1/2009","5/31/2019","FYD","46739.04"
"S589PM","SD YOUTH SERVICES ","SD  YOUTH SERVICES","NFL YOUTH EDUCATION TOWN","92110-4642","Lease","COMMUNITY CENTER","Held Over","2220 BROADWAY","1.0","6/1/1985","5/31/2008","FMD","389.17"
"S593PM","FAMILY HEALTH CENTERS OF SD, INC/03","FAMILY HEALTH CENTERS OF SD, INC","","92102-4541","Lease","BEHAVIORAL HEALTH CENTER","Normal","2181-2193 NATIONAL AVE& SAMPSON ST APN 538-550-16-00","1.0","12/7/2015","12/6/2040","FYD","4670.0"
"S597CS","VERIZON WIRELESS/POLICE-CENTRAL DIV","VERIZON WIRELESS/POLICE-CENTRAL DIV","","07921","Lease","COMMUNICATIONS EQUIPMENT","Normal","2501 IMPERIAL AVE","0.0","1/1/2018","12/31/2027","FYD","50196.76"
"S624PM","NEIGHBORHOOD HOUSE ASSOC","NEIGHBORHOOD HOUSE ASSOC","","92111-7902","Lease","SENIOR CITIZEN , NUTRITION &  SOCIAL SERVICE CENTER, MEETING SPACE. ","Normal","841 S. 41ST STREET","1.0","4/1/2011","3/31/2036","FYD","4712.15"
"S624PM","STORM WATER DEPARTMENT ","STORM WATER DEPARTMENT ","","92123","MOU","APN: 551-06-015-00","Normal","SAN MIGUEL AVE, SD, CA 92113","0.0","12/15/2025","12/14/2030","",""
"S630PM","ELEMENTARY INSTITUTE OF SCIENCE/02","ELEMENTARY INSTITUTE OF SCIENCE/02","","92114-2201","Lease","SCIENCE INSTRUCTION","Held Over","608 51ST STREET","1.0","2/1/2003","1/31/2018","FYD","4827.5"
"S641PM","SOUTHEAST COUNSELING & CONSULTING SVCS.","SOUTHEAST COUNSELING & CONSULTING SVCS.","PHOEBE HOUSE","92114-4118","Lease","TEMPORARY HOUSING - HOMELESS","Held Over","5879 IMPERIAL AVE., SD 92114","1.0","5/1/1999","4/30/2002","FSD","300.0"
"S706CS","SPRINT PCS ASSETS/SKYLINE PD","SPRINT PCS ASSETS LLC/SKYLINE DR","","66251-2650","Lease","COMMUNICATIONS EQUIPMENT","Normal","7222 SKYLINE DR. SD CA 92114","0.0","12/1/2018","11/30/2028","FYD","52833.96"
"S712WM","CITY--GENERAL SERVICES FROM WATER DEPT","CITY--GENERAL SERVICES FROM WATER DEPT","","92101","Permit","COMMUNICATIONS FACILITY","MTM","ENCANTO RESERVOIR SITE, STANDPIPE","0.0","3/28/1991","","",""
"S712WM","NEW CINGULAR WIRELESS/ENCANTO STANDPIPE","NEW CINGULAR WIRELESS PCS, LLC","","30319","Lease","TELECOMMUNICATIONS EQUIPMENT","Held Over","6780 AVIATION DR. ","0.0","9/1/2013","8/31/2023","FYD","47905.57"
"S712WM","T-MOBILE WEST LLC/ENCANTO SP","T-MOBILE WEST LLC/ENCANTO SP","","92121","Lease","TELECOM FACILITY","Held Over","6780 AVIATION DR","0.0","10/1/2010","9/30/2020","FYD","46738.67"
"S712WM","VERIZON WIRELESS/ENCANTO RESERVOIR","VERIZON WIRELESS/ENCANTO RESERVOIR","","07921","Lease","COMMUNICATIONS EQUIPMENT","Normal","6770 AVIATION DR. ENCANTO RESERVOIR","0.0","4/1/2018","3/31/2028","PYD","0.0"
"S736RD","BOYS & GIRLS CLUBS OF GREATER SD/03","BOYS & GIRLS CLUBS OF GREATER SAN DIEGO/03","","92177","Lease","GYM","Normal","6785 IMPERIAL AVE. SAN DIEGO, CA 92114","1.0","4/1/1984","3/31/2034","",""
"S802RD","VERIZON WIRELESS/SKYLINE HILLS","VERIZON WIRELESS-SKYLINE HILLS","","07921","Lease","COMMUNICATIONS EQUIPMENT","Held Over","8285 SKYLINE DR. ","0.0","2/1/2015","1/31/2025","FYD","55478.84"
"SDA-F","COX COMMUNICATIONS SAN DIEGO","COX COMMUNICATIONS SAN DIEGO","","92105-5486","Franchise","CABLE SERVICE","MTM","CITY STREETS SOUTH OF SD RIVER","0.0","2/1/2019","","PQR","0.0"
"SDA-F","JET INFRASTRUCTURE HOLDING IA LLC","JET INFRASTRUCTURE HOLDING IA LLC","","80129-2252","Franchise","PIPELINE TRANSPORT FOR JET FUEL & PETROLEUM. ","Held Over","CENTRE CITY","0.0","1/13/2000","1/12/2025","FYD","13669.79"
"SDA-F","JMIR - CHILLED WATER LLC","JMIR - CHILLED WATER LLC","","78701-4062","Franchise","Chilled water system in City streets","Normal","City Streets within the Ballpark District","0.0","6/8/2006","6/8/2056","PQR","0.0"
"SDA-F","METROPOLITAN TRANSIT SYSTEM","METROPOLITAN TRANSIT SYSTEM","","92101","Permit","SPUR TRACK FEES","MTM","COMMERCIAL ST. BETWEEN 30TH & 32ND STREETS","0.0","2/1/2024","","",""
"SDA-F","PACIFIC COAST RECYCLING LLC","PACIFIC COAST RECYCLING LLC","","92113","Permit","SPUR TRACK","MTM","COMMERCIAL ST. AT 30TH ST.","0.0","3/26/1946","","FYD","288.0"
"SDA-F","SDG&E","SDG&E","","92101","Franchise","ELECTRICITY","Held Over","CITY STREETS","0.0","12/30/1970","12/30/2020","",""
"SDA-F","SDG&E","SDG&E","","92101","Franchise","GAS","Held Over","CITY STREETS","0.0","12/31/1970","12/30/2020","",""
"SDA-F","SFPP LP","SFPP LP dba KINDER MORGAN","","77002-5089","Franchise","PETROLEUM PIPELINE","Held Over","N. CITY BOUNDARY, 10TH AVE TERM","0.0","1/6/1963","1/5/2005","PYR","38295.52"
"SDA-F","SOUTHERN CALIF GAS CO/02","SOUTHERN CALIF GAS CO/02","","90013-1011","Franchise","GAS PIPELINE FRANCHISE AT N. TORREY PINES RD","Normal","N. TORREY PINES RD., LA JOLLA","0.0","12/7/1983","12/6/2033","PYR","0.0"
"SDA-F","SPECTRUM PACIFIC WEST LLC","CHARTER COMMUNICATIONS, LLC","","92121","Franchise","CABLE TV","Normal","CITY STREETS NORTH OF S.D. RIVER","0.0","4/9/2020","1/2/2028","PQR","0.0"
"SDA-F","US NAVY/07","US NAVY/07","","92136-5198","Agreement","PIPE LINE INSTALLATION & MAINTENANCE AGREEMENT. ","Normal","STREETS IN PT. LOMA & MORENA AREA","0.0","8/19/2015","8/19/2065","",""
"STREET","CELLCO PARTNERSHIP/UOP #01","CELLCO PARTNERSHIP/UOP #1","","07921","Agreement","COMMUNICATIONS EQUIPMENT","Normal","VARIOUS POLES","0.0","12/1/2019","11/30/2029","FYD","2000.0"
"STREET","CELLCO PARTNERSHIP/UOP #02","CELLCO PARTNERSHIP/UOP #2","","07921","Permit","COMMUNICATIONS EQUIPMENT","Normal","VARIOUS POLES","0.0","1/1/2020","12/31/2029","FYD","400.0"
"STREET","CELLCO PARTNERSHIP/UOP #03","CELLCO PARTNERSHIP/UOP #3","","07921","Permit","COMMUNICATIONS EQUIPMENT","Normal","VARIOUS POLES","0.0","2/1/2020","1/31/2030","FYD","600.0"
"STREET","CELLCO PARTNERSHIP/UOP #04","CELLCO PARTNERSHIP/UOP #4","","07921","Permit","COMMUNICATIONS EQUIPMENT","Normal","VARIOUS POLES","0.0","2/1/2020","1/31/2030","FYD","1200.0"
"STREET","CELLCO PARTNERSHIP/UOP #05","CELLCO PARTNERSHIP/UOP #5","","07921","Permit","COMMUNICATIONS EQUIPMENT","Normal","VARIOUS POLES","0.0","2/15/2020","2/14/2030","FYD","700.0"
"STREET","CELLCO PARTNERSHIP/UOP #06","CELLCO PARTNERSHIP/UOP #6","","07921","Permit","COMMUNICATION EQUIPMENT","Normal","VARIOUS POLES","0.0","2/15/2020","2/14/2030","FYD","600.0"
"STREET","CELLCO PARTNERSHIP/UOP #07","CELLCO PARTNERSHIP/UOP #7","","07921","Permit","COMMUNICATIONS EQUIPMENT","Normal","VARIOUS POLES","0.0","3/1/2020","2/28/2030","FYD","800.0"
"STREET","CELLCO PARTNERSHIP/UOP #08","CELLCO PARTNERSHIP/UOP #8","","07921","Permit","COMMUNICATIONS EQUIPMENT","Normal","VARIOUS POLES","0.0","4/15/2020","4/14/2030","FYD","2000.0"
"STREET","CELLCO PARTNERSHIP/UOP #09","CELLCO PARTNERSHIP/UOP #9","","07921","Permit","COMMUNICATIONS EQUIPMENT","Normal","VARIOUS POLES","0.0","5/1/2020","4/20/2030","FYD","1300.0"
"STREET","CELLCO PARTNERSHIP/UOP #10","CELLCO PARTNERSHIP/UOP #10","","07921","Permit","COMMUNICATIONS EQUIPMENT","Normal","VARIOUS POLES","0.0","5/15/2020","5/14/2030","FYD","1400.0"
"STREET","CELLCO PARTNERSHIP/UOP #11","CELLCO PARTNERSHIP/UOP #11","","07921","Permit","COMMUNICATIONS EQUIPMENT","Normal","VARIOUS POLES","0.0","6/1/2020","5/31/2030","FYD","1900.0"
"STREET","CELLCO PARTNERSHIP/UOP #12","CELLCO PARTNERSHIP/UOP #12","","07921","Permit","COMMUNICATIONS EQUIPMENT","Normal","VARIOUS POLES","0.0","6/15/2020","6/14/2030","FYD","2500.0"
"STREET","CELLCO PARTNERSHIP/UOP #13","CELLCO PARTNERSHIP/UOP #13","","07921","Permit","COMMUNICATIONS EQUIPMENT","Normal","VARIOUS POLES","0.0","6/30/2020","6/29/2030","FYD","3500.0"
"STREET","CELLCO PARTNERSHIP/UOP #14","CELLCO PARTNERSHIP/UOP #14","","07921","Permit","COMMUNICATIONS EQUIPMENT","Normal","CELLCO PARTNERSHIP/UOP #14","0.0","7/15/2020","7/14/2030","FYD","4600.0"
"STREET","CELLCO PARTNERSHIP/UOP #15","CELLCO PARTNERSHIP/UOP #15","","07921","Permit","COMMUNICATIONS EQUIPMENT","Normal","VARIOUS POLES","0.0","7/24/2020","7/23/2030","FYD","2200.0"
"STREET","CELLCO PARTNERSHIP/UOP #16","CELLCO PARTNERSHIP/UOP #16","","07921","Permit","COMMUNICATIONS EQUIPMENT","Normal","VARIOUS POLES","0.0","7/31/2020","7/30/2030","FYD","1400.0"
"STREET","CELLCO PARTNERSHIP/UOP #17","CELLCO PARTNERSHIP/UOP #17","","07921","Permit","COMMUNICATIONS EQUIPMENT","Normal","VARIOUS POLES","0.0","8/14/2020","8/13/2030","FYD","2500.0"
"STREET","CELLCO PARTNERSHIP/UOP #18","","","","Permit","COMMUNICATIONS EQUIPMENT","Normal","VARIOUS POLES","0.0","8/25/2020","8/24/2030","FYD","2000.0"
"STREET","CELLCO PARTNERSHIP/UOP #19","CELLCO PARTNERSHIP/UOP #17","","07921","Permit","COMMUNICATIONS EQUIPMENT","Normal","VARIOUS POLES","0.0","9/16/2020","9/15/2030","FYD","2500.0"
"STREET","CELLCO PARTNERSHIP/UOP #20","","","","Permit","COMMUNICATIONS EQUIPMENT","Normal","VARIOUS POLES","0.0","9/25/2020","9/24/2030","FYD","1700.0"
"STREET","CELLCO PARTNERSHIP/UOP #21","","","","Permit","COMMUNICATIONS EQUIPMENT","Normal","VARIOUS POLES","0.0","10/9/2020","10/8/2030","FYD","1600.0"
"STREET","CELLCO PARTNERSHIP/UOP #22","","","","Permit","COMMUNICATIONS EQIUPMENT","Normal","VARIOUS POLES","0.0","10/16/2020","10/15/2030","FYD","1300.0"
"STREET","CELLCO PARTNERSHIP/UOP #23","","","","Permit","COMMUNICATIONS EQIUPMENT","Normal","VARIOUS POLES","0.0","10/23/2020","10/22/2030","FYD","1500.0"
"STREET","CELLCO PARTNERSHIP/UOP #24","CELLCO PARTNERSHIP/UOP #24","","07921","Permit","COMMUNICATIONS EQUIPMENT","Normal","VARIOUS POLES","0.0","11/6/2020","11/5/2030","FYD","1800.0"
"STREET","CELLCO PARTNERSHIP/UOP #25","","","","Permit","COMMUNICATION EQUIPMENT","Normal","VARIOUS POLES","0.0","11/18/2020","11/17/2030","FYD","1600.0"
"STREET","CELLCO PARTNERSHIP/UOP #26","CELLCO PARTNERSHIP/UOP #26","","07921","Permit","TELECOMMUNICATIONS EQUIPMENT","Normal","VARIOUS POLES","0.0","12/7/2020","12/6/2030","FYD","1400.0"
"STREET","CELLCO PARTNERSHIP/UOP #27","CELLCO PARTNERSHIP/UOP #27","","07921","Permit","COMMUNICATIONS EQUIPMENT","Normal","VARIOUS POLES","0.0","12/22/2020","12/21/2030","FYD","2200.0"
"STREET","CELLCO PARTNERSHIP/UOP #28","CELLCO PARTNERSHIP/UOP #28","","07921","Permit","TELECOMMUNICATIONS EQUIPMENT","Normal","VARIOUS POLES","0.0","1/15/2021","1/14/2031","FYD","1900.0"
"STREET","CELLCO PARTNERSHIP/UOP #29","CELLCO PARTNERSHIP/UOP #29","","07921","Permit","COMMUNICATIONS/TELECOM","Normal","VARIOUS POLES","0.0","1/15/2021","1/14/2031","FYD","2100.0"
"STREET","CELLCO PARTNERSHIP/UOP #30","CELLCO PARTNERSHIP/UOP #30","","07921","Permit","COMMUNICATIONS EQUIPMENT","Normal","VARIOUS POLES","0.0","2/9/2021","2/8/2031","FYD","2300.0"
"STREET","CELLCO PARTNERSHIP/UOP #31","CELLCO PARTNERSHIP/UOP #31","","07921","Permit","COMUNICATIONS EQUIPMENT","Normal","VARIOUS POLES","0.0","2/23/2021","2/22/2031","FYD","2000.0"
"STREET","CELLCO PARTNERSHIP/UOP #32","CELLCO PARTNERSHIP/UOP #32","","07921","Permit","COMMUNICATIONS/TELECOM","Normal","VARIOUS POLES","0.0","3/2/2021","3/1/2031","FYD","2200.0"
"STREET","CELLCO PARTNERSHIP/UOP #33","CELLCO PARTNERSHIP/UOP #33","","07921","Permit","COMMUNICATIONS EQUIPMENT","Normal","VARIOUS POLES","0.0","3/15/2021","3/14/2031","FYD","2800.0"
"STREET","CELLCO PARTNERSHIP/UOP #34","CELLCO PARTNERSHIP/UOP #34","","07921","Permit","COMMUNICATIONS EQUIPMENT","Normal","VARIOUS POLES","0.0","3/26/2021","3/25/2031","FYD","2500.0"
"STREET","CELLCO PARTNERSHIP/UOP #35","CELLCO PARTNERSHIP/UOP #35","","07921","Permit","COMMUNICATIONS EQUIPMENT","Normal","VARIOUS POLES","0.0","4/9/2021","4/8/2031","FYD","2400.0"
"STREET","CELLCO PARTNERSHIP/UOP #36","CELLCO PARTNERSHIP/UOP #36","","07921","Permit","COMMUNICATIONS EQUIPMENT","Normal","VARIOUS POLES","0.0","6/11/2021","6/10/2031","FYD","3800.0"
"STREET","CELLCO PARTNERSHIP/UOP #37","CELLCO PARTNERSHIP /UOP #37","","07921","Permit","COMMUNICATIONS EQUIPMENT","Normal","VARIIOUS POLES","0.0","10/4/2022","10/3/2032","FYD","500.0"
"STREET","CROWN CASTLE FIBER LLC","CROWN CASTLE NG WEST LLC","","15317-8564","Permit","OPTICAL REPEATERS & ANTENNAS","Normal","VARIOUS LOCATIONS","0.0","7/1/2019","6/30/2029","PYD","0.0"
"STREET","FREEDOM TELECOMMUNICATIONS LLC","FREEDOM TELECOMMUNICATIONS LLC","","90017-3326","Permit","COMMUNICATIONS EQUIPMENT","Normal","VARIOUS CITY LIGHT POLES/ UP TO 100 SITES","0.0","9/1/2016","8/31/2026","FYR","464381.74"
"STREET","MOBILITIE LLC/SMALL CELL ","MOBILITE LLC/SMALL CELL ","","92660","Agreement","COMMUNICATIONS EQUIPMENT","Normal","VARIOUS LIGHT POLES","0.0","7/1/2019","6/30/2029","FYD","5670.0"
"STREET","NEW CINGULAR WIRELESS PCS/SMALL CELL","NEW CINGULAR WIRELESS PCS/ SMALL CELL","","30319","Agreement","COMMUNICATIONS EQUIPMENT","Normal","144 VARIOUS LIGHT POLES","0.0","7/1/2019","6/30/2029","FYD","38610.0"
"STREET","NEW CINGULAR WIRELESS/ROW NORTH","NEW CINGULAR WIRELESS/ROW NORTH","","92121","Lease","COMMUNICATIONS EQUIPMENT","Normal","SW CORNER  OF TORREY PINES SCENIC DR & N. TORREY PINES RD","0.0","4/1/2018","3/31/2028","FYD","21727.35"
"STREET","NEW CINGULAR WIRELESS/ROW SOUTH","NEW CINGULAR  WIRELESS/ROW SOUTH","","30324","Lease","COMMUNICATIONS EQUIPMENT","Normal","NW CORNER OF EXPEDITION WAY& N.TORREY PINES RD","0.0","4/1/2018","3/31/2028","FYD","21727.35"
