"site_code","lessee_name","lessee_company","lessee_DBA","address_zip","lease_record_type","lease_description","lease_status","lease_location_name","nonprofit_lessee","date_effective","date_sched_termination","rent_code","cost_line_amt_USD"
"F603WR","VERIZON WIRELESS/ LOS PENASQUITOS RESERVOIR","VERIZON WIRELESS/PENASQUITOS RESERVOIR","","92618","Lease","TELECOM FACILITY","Held Over","10985 AVENIDA MARIA","0.0","6/1/2011","5/31/2021","FYD","44056.0"
"F604WM","SD COUNTY AIR POLLUTION CONTROL DIST","SD COUNTY AIR POLLUTION CONTROL DIST","","92131","Permit","NEAR ROAD N02 MONITORING STATION","Held Over","11403 RANCHO CARMEL DR, SD CA 92128","0.0","2/1/2021","1/31/2024","",""
"G301RU","BAY CLUB FAIRBANKS RANCH LLC","BAY CLUB FAIRBANKS RANCH, LLC","","92067","Agreement","COUNTRY CLUB","Normal","15150 SAN DIEGUITO RD","0.0","9/27/1983","7/17/2056","PQR","0.0"
"G301RU","SAN DIEGUITO RIVER PARK JPA","SAN DIEGUITO RIVER PARK JPA","","92025","Agreement","OSUNA SEGMENT OF CTC TRAIL","Normal","15150 SAN DIEGUITO RD","0.0","5/7/2024","5/6/2049","",""
"G301RU","SURF SPORTS LLC","SURF SPORTS, LLC","","92067-2609","Lease","SOCCER-PROGRAMS, ACTIVITIES, & OPERATIONS PER THE GRANT DEED.","Normal","14555 EL CAMINO REAL","0.0","9/1/2016","12/31/2044","PQR","69780.0"
"G305R2","VERIZON WIRELESS/TORREY HIGHLANDS PARK","VERIZON WIRELESS-TORREY HIGHLANDS PARK","","07921","Lease","COMMUNICATIONS EQUIPMENT","Held Over","4450 LANSDALE DR. ","0.0","11/1/2013","10/31/2023","FYD","46510.26"
"G314RS","TMO NSB PACIFIC HIGHLANDS RANCH ","TMO NSB PACIFIC HIGHLANDS RANCH ","","98006-1350","License","CARRIER/TENANT ID: SD07720A","Pending","5977 Village Center Loop Rd, San Diego, CA 92130","0.0","7/1/2027","","",""
"H201PM","CRYSTAL PIER MOTEL INC","CRYSTAL PIER MOTEL INC","","92109-2459","Lease","MOTEL AND FISHING PIER\HOTEL","Held Over","4500 OCEAN BOULEVARD","0.0","8/1/1989","7/31/2024","PMR","154376.48"
"H201PM","ENDLESS SURF CAMP LLC","ENDLESS SURF CAMP LLC","","92117-4607","Agreement","SURF CONCESSION","Normal","SITE #2 OLD MISSION BEACH LIFEGUARD TOWER, MISSION BEACH","0.0","5/31/2024","5/31/2029","PMR","341.37"
"H201PM","FISHER, CHARLES E. III","FISHER, CHARLES E. III","","92019-3608","Lease","RESTAURANT/ BAIT & TACKLE","Held Over","5091 NIAGARA AVENUE","0.0","3/1/2000","2/28/2010","",""
"H201PM","FISHER, CHARLES E. III/02","FISHER, CHARLES E. III/02","","92118","Permit","SUPPLIES DELI./MAINT/REPAIR","Held Over","5091 NIAGARA AVENUE","0.0","4/12/2004","12/1/2006","",""
"H201PM","HIKE BIKE KAYAK ADVENTURES LLC","HIKE BIKE KAYAK ADVENTURES LLC","","92037","Agreement","KAYAK CONCESSION","Normal","LA JOLLA SHORES-BOAT LAUNCH & BEACH125’ N. FROM SOUTHERN END.","0.0","4/1/2025","3/31/2030","PMR","4299.41"
"H201PM","HLS VENTURES LLC ","HLS VENTURES LLC","EVERYDAY CALIFORNIA","92037-5070","Agreement","KAYAK CONCESSION","Normal","LA JOLLA SHORES-BOAT LAUNCH ZONE & BEACH, 125 FT NORTH FROM THE SOUTH END. ","0.0","4/1/2025","3/31/2030","PMR","20790.15"
"H201PM","HLS VENTURES LLC/02 ","HLS VENTURES LLC/02","","92037","Agreement","SURF CONCESSION","Normal","SITE# 13 LA JOLLA SHORES","0.0","6/1/2024","5/31/2029","PMR","2623.85"
"H201PM","LA JOLLA KAYAK & COMPANY LLC","LA JOLLA KAYAK & CO. LLC","","92037-3215","Agreement","KAYAK CONCESSION","Normal","LA JOLLA SHORES-BOAT LAUNCH ZONE & BEACH, 125’ N. FROM SOUTHERN END","0.0","4/1/2025","3/31/2030","PMR","15722.12"
"H201PM","LA JOLLA SEA CAVE KAYAKS LLC","LA JOLLA SEA CAVE KAYAKS LLC","","92037-3214","Agreement","KAYAK CONCESSION","Normal","LA JOLLA SHORES-BOAT LAUNCH & BEACH, 125 N. FROM SOUTHERN END.","0.0","4/1/2025","3/31/2030","PMR","8005.21"
"H201PM","MACFARLANE JOAN TRUST 7-14-97","MACFARLANE JOAN TRUST 7-14-97","","92037","Permit","SEAWALLS (2)","MTM","ADJ TO 6040 CAMINO DE LA COSTA","0.0","12/31/1987","","",""
"H201PM","PACIFIC BEACH SURF SHOP INC","PACIFIC BEACH SURF SHOP INC","","92117-1129","Agreement","SURF CONCESSION","Normal","SITE# 4 SANTA RITA ST. PACIFIC BEACH","0.0","6/1/2024","5/31/2029","PMR","4338.52"
"H201PM","PACIFIC SURF SCHOOL INC","PACIFIC SURF SCHOOL INC","","92109-3906","Agreement","SURF CONCESSION ","Normal","SITE# 3-NEW SOUTH MISSION BEACH, SITE# 5-PACIFIC BEACH DR","0.0","6/1/2024","5/31/2029","PMR","6576.73"
"H201PM","SD BIKE & KAYAK TOURS INC","SD BIKE & KAYAK TOURS INC","","92037-3226","Agreement","KAYAK CONCESSION","Normal","LA JOLLA SHORES BOAT LAUNCH & BEACH, 125’ N. FROM SOUTHERN END.","0.0","4/1/2025","3/31/2030","PMR","12204.17"
"H201PM","SD SURFING SCHOOL INC","SD SURFING SCHOOL INC","","92109-2623","Agreement","SURF CONCESSION","Normal","OB-SITE# 1 SANTA MONICA PL, PB-SITE# 8 LAW ST. ","0.0","6/1/2024","5/31/2029","PMR","16244.73"
"H201PM","SURF DIVA, INC","SURF DIVA, INC","","92037-3247","Agreement","SURF CONCESSION","Normal","SITE# 8 & 9, near Lifeguard Tower LA JOLLA SHORES","0.0","6/1/2024","5/31/2029","PMR","10655.48"
"H201PM","SURF EDUCATION ACADEMY LLC","SURF EDUCATION ACADEMY LLC","","92124-2018","Agreement","SURF CONCESSION","Normal","LA JOLLA SHORES SITE #12","0.0","6/1/2024","5/31/2029","PMR","2930.99"
"H201RD","REGENTS OF THE UNIVERSITY OF CA/01","REGENTS OF THE UNIVERSITY OF CA/01","","92039-0982","Agreement","RESEARCH FAC","Normal","LA JOLLA UNDERWATER PARK","0.0","4/27/1972","8/17/2036","",""
"H212FS","TMO CA/NV, LLC/09","TMO CA/NV, LLC/09","T-MOBILE WEST CORPORATION","98006-1350","Lease","TELECOMMUNICATION","Held Over","13077 HARTFIELD AVE.","0.0","9/1/2002","8/31/2012","FMD","5835.9"
"H219RD","DISH WIRELESS LLC","DISH WIRELESS LLC","","80120-1813","License","COMMUNICATIONS EQUIPMENT","Normal","  3777 TOWNSGATE DR., SD, CA 92130","0.0","7/17/2024","7/16/2034","FYD","46968.0"
"H504RD","VERIZON WIRELESS NSB RIDGEWOOD  NEIGHBORHOOD PARK","NSB - VERIZON WIRELESS VAW LLC / RIDGEWOOD","","92029","License","NSB, TENANT ID: KIKA","Pending","12604 La Tortola San Diego, CA 92129","0.0","6/30/2027","","",""
"H504RO","CANYONSIDE  EQUESTRIAN CENTER INC","CANYONSIDE  EQUESTRIAN CENTER INC","","92129-3578","Agreement","EQUESTRIAN BOARDING FACILITY","Normal","12115 BLACK MOUNTAIN RD SD CA 92129","0.0","1/23/2026","1/22/2029","FMD","2575.0"
"H509RU","NEW CINGULAR WIRELESS PCS/04","NEW CINGULAR WIRELESS PCS/04","","30319","Lease","TELECOMMUNICATIONS FACILITY","Held Over","38100 BLACK MTN RD. ","0.0","1/1/2012","12/31/2021","FYD","45376.52"
"H509RU","VERIZON WIRELESS/RANCHO PENASQUITOS OS","VERIZON WIRELESS RANCHO PENASQUITOS","","07921","Lease","COMMUNICATIONS EQUIPMENT","Normal","12871 BLACK MTN RD (SE OF BLK MTN RD AT CA RT 56 HWY)","0.0","12/1/2018","11/30/2028","FYD","48346.61"
"H516PM","STATE OF CA/DEPT OF TRANS/04","STATE OF CA/DEPT OF TRANS/04","","92110","Lease","PARK & RIDE","Normal","10029 CARMEL MOUNTAIN RD SD CA 92129","0.0","6/10/2024","5/9/2029","",""
"H615PM","STATE OF CA/DEPT OF TRANS/01","STATE OF CA/DEPT OF TRANS/01","","92110","Agreement","PARK & RIDE","Normal","12656 SABRE SPRINGS PARKWAY","0.0","6/10/2024","5/9/2029","",""
"I204R1","TMO NSB CARMEL VALLEY RSTOR/CVREP","TMO NSB CARMEL VALLEY RSTOR/CVREP","","98006-1350","License","CARRIER/TENANT ID: SD07722A","Pending","ROUTE 56 SLY OF & ELY EL CAMINO REAL ","0.0","7/1/2027","","",""
"I209RO","STATE OF CA/DEPT OF TRANS/21","STATE OF CA/DEPT OF TRANS","","92110","License","CONSTRUCT BIKE PATH WITH MITIGATION TO FOLLOW","Normal","SORRENTO VALLEY","0.0","9/26/2022","12/31/2030","",""
"I402R4","NEW CINGULAR WIRELESS/CAMINO RUIZ PARK","NEW CINGULAR WIRELESS PCS/CAMINO RUIZ PARK","","30319","Lease","TELECOM FACILITY  ","Held Over","11498 CAMINO RUIZ","0.0","2/1/2011","1/31/2021","FMD","3894.91"
"I402R4","T-MOBILE NSB CAMINO RUIZ PARK","T-MOBILE NSB CAMINO RUIZ PARK","","98006","License","NSB CARRIER ID: SD07738A","Pending","CAMINO RUIZ NWLY/NLY CALLE CRISTOBAL","0.0","7/1/2026","","",""
"I402R4","VERIZON WIRELESS/CAMINO RUIZ PARK","VERIZON WIRELESS/CAMINO RUIZ PARK","","07921","Lease","COMMUNICATIONS TELECOM FACILITY","Normal","11498 CAMINO RUIZ","0.0","8/26/2024","8/25/2034","FYD","44056.0"
"I506PM","STATE OF CALIFORNIA DOT ","STATE OF CALIFORNIA DOT ","","92126","Agreement","PARKING SPACES ","Normal","9650 MIIRA MESA BOULEVARD SAN DIEGO CA 92126","0.0","6/10/2024","5/9/2029","",""
"I514PM","STATE OF CALIFORNIA DOT","STATE OF CALIFORNIA DEPARTMENT OF TRANSPORTATION ","","92113","Lease","120 PARKING SPACES ","Normal","12016 SCRIPPS HIGHLAND DRIVE SAN DIEGO CA 92113","0.0","6/10/2024","5/9/2029","",""
"I615WR","T-MOBILE WEST LLC/MIRAMAR RANCH","T-MOBILE WEST LLC/MIRAMAR RANCH","","92121","Lease","TELECOMMUNICATIONS FACILITY","Held Over","11496 WEATHERHILL WAY","0.0","12/1/2011","11/30/2021","FYD","45377.35"
"I615WR","VERIZON WIRELESS/MIRAMAR RANCH NORTH RESERVOIR","VERIZON WIRELESS/MIRAMAR RANCH NORTH","","07921","Lease","TELECOM FACILITY","Normal","11484 WEATHERHILL WAY SD, CA 92131","0.0","10/1/2018","9/30/2028","FYD","53090.03"
"I617R1","SCRIPPS RANCH CIVIC ASSOCIATION","SCRIPPS RANCH CIVIC ASSOCIATION","","92131","Permit","OFFICE/COMMUNITY CENTER","Held Over","11885 CYPRESS CANYON ROAD","1.0","2/1/2015","1/31/2018","FMD","140.0"
"I620RD","SOCIAL ADVOCATES FOR YOUTH (SAY)/02","SOCIAL ADVOCATES FOR YOUTH (SAY)/02","","92123-1641","Lease","CHILD CARE CENTER","Held Over","11838 SCRIPPS POWAY PARKWAY","1.0","7/1/2003","6/30/2013","FYD","4670.0"
"I622FS","VERIZON WIRELESS/ BLUE CYPRESS FS 37","VERIZON WIRELESS/BLUE CYPRESS FS37","","07921","Lease","COMMUNICATIONS EQUIPMENT","Normal","11640 SPRING CANYON RD","0.0","12/1/2017","11/30/2027","FYD","50038.74"
"I629RS","YMCA OF SD COUNTY-SCRIPPS RANCH","YMCA OF SD COUNTY - SCRIPPS RANCH","","92129-2634","Lease","COMMUNITY CENTER","Extended","10481 SCRIPPS POWAY PARKWAY","1.0","1/1/2005","12/31/2039","FYD","4670.0"
"I701WR","VERIZON WIRELESS/03","VERIZON WIRELESS/03","","92618","Lease","COMMUNICATION FACILITY","Held Over","SPRING CANYON RD & RIESLING/SCRIPPS RESV","0.0","1/1/2001","12/31/2015","FMD","3790.65"
"I803WM","VERIZON WIRELESS/BEELER CANYON","VERIZON WIRELESS/BEELER CANYON","","92618","Lease","TELECOM FACILITY","Held Over","16688 Stonebridge Pkwy","0.0","10/1/2010","9/30/2020","FYD","46738.67"
"J202P1","JRK TORREY PINES HOTEL OWNER LLC","JRK TORREY PINES HOTEL OWNER LLC","","92037","Lease","HILTON HOTEL","Normal","10950 N. TORREY PINES RD.","0.0","7/1/1988","6/30/2067","PMR","196752.89"
"J202P1","LODGE AT TORREY PINES PARTNERSHIP","EVANS HOTELS","","92109","Lease","HOTEL, RESTAURANT","Normal","11480 NORTH TORREY PINES ROAD","0.0","6/5/1995","6/4/2061","PMR","0.0"
"J202P1","SCRIPPS HEALTH","SCRIPPS HEALTH","SHILEY FITNESS CENTER","92121","Lease","FITNESS/SPORTS/HEALTH CENTER","Normal","10820 N. TORREY PINES ROAD","0.0","2/8/1988","7/31/2043","FMD","88738.53"
"J202PM","REGENTS OF THE UNIVERSITY OF CA/03","REGENTS OF THE UNIVERSITY OF CA/03","UCSD-ASS'T VICE CHANCELLOR-RE","92093-0982","Industrial","INDUSTRIAL DEVELOPMENT","Normal","10280 NORTH TORREY PINES RD LJ CA 92037","0.0","2/1/1985","1/31/2040","FMD","66295.13"
"J202RD","AIR CALIFORNIA ADVENTURE, INC","AIR CALIFORNIA ADVENTURE, INC","","92037","Agreement","GLIDERPORT AND CONCESSION","Held Over","2800 TORREY PINES SCENIC DR.","0.0","5/1/2022","3/30/2025","FYD","3852.0"
"J202RD","City--Golf Course Fund","","","","MOU","GC Fund ground lease from Park and Rec","MTM","Torrey Pines ","0.0","7/1/2012","","FYD","1927597.0"
"J202RD","TORREY PINES CLUB CORP","TORREY PINES CLUB CORP","","92037-1045","Lease","PRO-SHOP/DRIVING RANGE/CARTS","Extended","11480 N. TORREY PINES RD LA JOLLA 92037","0.0","1/1/1988","12/31/2032","PMR","97971.89"
"J401RD","MOBILITIE INVESTMENTS III, LLC/02","MOBILITIE INVESTMENTS III, LLC/02","","92660-6403","Lease","COMMUNICATIONS EQUIPMENT","Normal","7540 WINTERWOOD LN. SD CA 92126","0.0","5/1/2017","4/30/2027","",""
"J603WR","ADVENCO LLC","ADVENCO LLC","","66223","Permit","BOAT RENTAL, MERCHANDISE & PERMIT SALES. ","Normal","VARIOUS CITY RESERVOIRS","0.0","3/1/2018","2/28/2038","PMR","5239.38"
"J603WR","SONTEK","SONTEK","","92121","Permit","EQUIPMENT TESTING","Held Over","MIRAMAR & LAKE MURRAY RESERVOIRS","0.0","2/1/2018","1/31/2021","FMD","1118.54"
"J603WR","TELEDYNE RD INSTRUMENTS","TELEDYNE RD INSTRUMENTS","","92064-6846","Permit","SONAR TESTING INSTRUMENTS","Held Over","LAKE MIRAMAR & EL CAPITAN RESERVOIR","0.0","12/5/2017","12/4/2020","FMD","1118.54"
"J701PM","CA NATIVE PLANT SOCIETY","CA NATIVE PLANT SOCIETY","","92131","Permit","MONITORING ENDANGERED PLANT SPECIES","Normal","POMERADO RD. SD, CA 92131","1.0","2/1/2024","1/31/2027","",""
"K001WR","SD RIVER PARK FOUNDATION","SD RIVER PARK FOUNDATION","","92110","Permit","CONTROL OF INVASIVE PLANTS","Held Over","EL CAPITAN RESERVOIR","1.0","12/21/2020","12/20/2023","",""
"K001WR","US NAVY/EL CAPITAN RESERVOIR","US NAVY/EL CAPITAN RESERVOIR","","92132-5190","Permit","TESTING SONAR EQUIPMENT","Extended","EL CAPITAN RESERVOIR","0.0","6/28/2023","6/27/2026","FYD","2546.16"
"K205PM","BOYL, MAXINE (TRUSTEE)","BOYL, MAXINE (TRUSTEE)","","92037-1145","Lease","ACCESS TO LESSEES PROPERTY","Held Over","PORTION PUEBLO LOT 1311","0.0","7/1/1987","2/29/2016","FYD","848.94"
"K205PM","FEIFER, KATIE & RICHARD","FEIFER, KATIE & RICHARD","","92037-1145","Lease","ACCESS TO LESSEES PROPERTY","Held Over","PORTION PUEBLO LOT 1311","0.0","3/1/1986","2/29/2016","FYD","848.94"
"K205PM","WESTON, ROBERT L & SUSAN E","WESTON, ROBERT L & SUSAN E","","92037-1145","Lease","ACCESS TO LESSEES PROPERTY","Held Over","PORTION PUEBLO LOT 1311","0.0","3/1/1986","2/29/2016","FYD","848.94"
"K301RD","JEWISH COMMUNITY CENTER","JEWISH COMMUNITY CENTER","JACOBS FAMILY CAMPUS","92037","Lease","COMMUNITY CENTER","Normal","4126 EXECUTIVE DRIVE","1.0","10/1/1982","12/31/2047","FMR","1526.34"
"K302MM","OHLA USA INC","OHLA USA INC","","92614","Agreement","PURE WATER STAGING SITE","Held Over","10320 ROSELLE ST","0.0","3/8/2024","12/31/2024","",""
"K302P1","NISSAN DESIGN INTERNATIONAL","NISSAN DESIGN INTERNATIONAL","","92121","Industrial","AUTO DESIGN STUDIOS","Normal","9800 CAMPUS POINT DR","0.0","2/18/1982","2/17/2037","",""
"K302PM","INSTITUTE FOR DEFENSE ANALYSES","INSTITUTE FOR DEFENSE ANALYSES","CENTER FOR COMMUNICATIONS RESEARCH - LA JOLLA","22311-1882","Industrial","GOVERNMENT THINK TANK","Normal","4320 WESTERRA CT, SAN DIEGO 92121","0.0","10/1/1991","9/30/2046","FYD","10008.78"
"K315MM","PACIFIC BELL/01","PACIFIC BELL/01","AT&T","92111-7906","Permit","UNDERGROUND COMMUNICATION FACILITIES","Held Over","4949 EASTGATE MALL","0.0","1/1/2011","12/31/2020","FMD","585.31"
"L002WP","UDELL, TODD R & SHERI L","UDELL, TODD R & SHERI L","","92071-1936","Lease","HAY STORAGE AND SALES","Held Over","10530 VINE STREET, LAKESIDE","0.0","8/1/2019","7/31/2022","FMD","900.0"
"L010PM","BENEVOLENT AND PROTECTIVE ORDER OF ELKS","BENEVOLENT & PROTECTIVE ORDER OF ELKS","BPOE ELKS LODGE","92072-2698","Permit","OVERFLOW PARKING @ ELKS LODG","Held Over","SANTEE, ADJACENT 11633 WOODSIDE AVE","1.0","4/28/2003","12/31/2005","FMD","630.0"
"L201PM","YMCA OF SD COUNTY - LA JOLLA BRANCH","DAN MCKINNEY FAMILY YMCA","","92037","Lease","COMMUNITY CENTER","Normal","8355 CLIFFRIDGE AVENUE","1.0","5/1/2002","4/30/2027","",""
"L207RD","LA JOLLA YOUTH INC.","LA JOLLA YOUTH INC.","","92037","Lease","ATHLETIC FIELD","Extended","3908 TORREY PINES RD","1.0","8/1/2005","7/31/2030","FYD","4670.0"
"L301LB","VERIZON WIRELESS/UNIVERSITY BRANCH LIBRARY","VERIZON WIRELESS/UNIVERSITY BRCH LIBRARY","","07921","Lease","COMMUNICATIONS EQUIPMENT","Normal","4155 GOVERNOR DR. SD, CA  92122","0.0","3/1/2019","2/28/2029","FYD","49801.3"
"L303FS","FALCK MOBILE HEALTH CORP","FALCK MOBILE HEALTH CORP","","92868-1125","License","SLEEPING ACCOMMODATIONS, PARKING, EMERGENCY REPAIR OF AMBULANCES","Normal","VARIOUS FIRE STATIONS","0.0","11/27/2021","11/26/2031","",""
"L303RS","TMO NSB NOBEL ATHLETIC AREA","TMO NSB NOBEL ATHLETIC AREA","","98006-1350","License","CARRIER/TENANT ID: SD07721A","Pending","8810 Judicial Dr, San Diego, CA 92122","0.0","7/1/2027","","",""
"L308RD","NEW CINGULAR WIRELESS PCS LLC/DOYLE PARK","NEW CINGULAR WIRELESS PCS LLC","","30319","Lease","TELECOM","Held Over","8175 REGENTS RD, SD, CA 92122","0.0","8/01/2012","10/31/2022","FYD","49342.6"
"L308RD","SOCIAL ADVOCATES FOR YOUTH (SAY)","SOCIAL ADVOCATES FOR YOUTH (SAY)/02","SAY, SAN DIEGO, INC.","92123-1641","Lease","CHILD CARE CENTER","Held Over","8175 REGENTS ROAD","1.0","9/1/1996","8/31/2011","FMD","725.0"
"L308RD","VERIZON WIRELESS (VAW) LLC\DOYLE PARK","VERIZON WIRELESS (VAW) LLC","","07921","Permit","SOILS TESTING","Held Over","8175 REGENTS RD","0.0","11/19/2019","2/17/2020","",""
"L401VM","CITY/US MARINE CORPS","CITY/US MARINE CORPS","","92132-5190","Lease","SOLID WASTE DISPOSAL/MONITOR","Normal","5165 CONVOY ST. SD, CA 92111-1207 SO. OF NAS MIRAMAR & NO. OF STATE RTE.52","0.0","8/17/1995","8/16/2045","",""
"M101PM","YMCA/02 FIREHOUSE","YMCA/02 FIREHOUSE","","92024-2720","Lease","COMMUNITY CENTER","Extended","7877 HERSCHEL AVENUE LA JOLLA","1.0","11/01/2012","10/31/2037","FYD","4532.5"
"M124PM","LA JOLLA COMMUNITY CENTER","LA JOLLA COMMUNITY CENTER","","92037-6136","Lease","SENIOR CITIZEN CENTER","Normal","6811 LA JOLLA BOULEVARD","1.0","8/20/2018","8/19/2038","FYD","4670.0"
"M305RD","PSCT NSB GERSHWIN PARK","PSCT NSB GERSHWIN PARK","","92011","License","NSB CARRIER ID: SAND03","Pending","CONRAD AV & GAYLORD DR","0.0","7/1/2026","","",""
"M505PM","DDR GENERAL CONTRACTING INC/01","DDR GENERAL CONTRACTING INC/01","","92629-3248","License","ABOVE GROUND PROPANE TANKS","Normal","5596 KEARNY MESA RD SD CA 92111","0.0","6/5/2025","6/4/2028","FMD","1985.0"
"M505PM","WASTE MANAGEMENT OF CA INC","WASTE MANAGEMENT OF CA INC","","60148","Agreement","TRANSFER CONTAINER STORAGE","Normal","KEARNY MESA RD. & MAGNATRON BLVD.","0.0","11/1/2023","10/31/2026","FMD","3075.71"
"M512PM","JAMES & STEPHANIE PRIMES FAMILY TRUST","JAMES & STEPHANIE PRIMES FAMILY TRUST","","91325-1835","Permit","PARKING & STORAGE","Normal","ADJACENT TO 9630 CHESAPEAKE DR","0.0","2/5/2025","2/4/2028","FMD","1282.37"
"M513MM","MOC","","","","City Use","","MTM","MOC","0.0","","","",""
"M515MM","VERIZON WIRELESS/MOC","VERIZON WIRELESS (VAW) LLC","","07921","Lease","COMMUNICATIONS EQUIPMENT","MTM","9175 KEARNY VILLA CT. MOC","0.0","1/1/2015","12/31/2024","FYD","55478.85"
"M801WM","ALIKA LLC","ALIKA LLC","","92071-2310","Lease","GOLF COURSE","Normal","9200 INWOOD DR SANTEE CA 92071","0.0","1/1/2012","12/31/2051","FQD","52986.53"
"N208PM","SOLEDAD CLUB","SOLEDAD CLUB","","92109-1408","Lease","PUBLIC MTG. ROOMS","Held Over","5050 SOLEDAD ROAD","1.0","9/1/2015","8/31/2025","PYR","6000.0"
"N303R1","EMERGENCY MEDICAL SERVICES AUTHORITY (EMSA)","EMERGENCY MEDICAL SERVICES AUTHORITY (EMSA)","","95670","License","ANTIBODY THERAPY FOR COVID-19 PATIENTS","Held Over","4425 BANNOCK AVE SD CA 92117","0.0","8/28/2021","10/29/2022","",""
"N305GM","CITY--Rose Canyon Operations Station","","","","Lease","","MTM","","0.0","","","",""
"N402RD","STATE OF CA/DEPT OF TRANS/10","STATE OF CA/DEPT OF TRANS/10","CALTRANS","92110","Permit","RAMP METERING","MTM","ECKSTROM AVE I-805","0.0","10/26/1983","","",""
"N403PM","LA CASA BALBOA, LLC","LA CASA BALBOA, LLC","","92108-3777","Lease","LOW-INCOME HOUSING","Normal","6106 BEADNELL WAY","0.0","7/1/1979","6/30/2034","PMR","1280.0"
"N419PM","MERCURY STREET ANNEX, LLC","MERCURY STREET ANNEX, LLC","","92121-2604","Lease","INDUSTRIAL/COMMERCIAL","Normal","4611 MERCURY ST., SAN DIEGO CA 92111","0.0","7/1/1986","6/30/2041","PYR","0.0"
"N506CS","CITY-SD POLICE DEPT. FROM AIRPORTS","CITY-SD POLICE DEPT. FROM AIRPORTS","","92123","MOU","OPER-SDPD EASTERN TRAFFIC DIVISION","Normal","9225 & 9265 AERO DRIVE","0.0","7/1/2024","6/30/2034","FMD","49440.0"
"N506PM","CITY--ENG & CAP PROJECTS FROM AIRPORTS","CITY--ENG & CAP PROJECTS FROM AIRPORTS","","92123-1765","Permit","DEVELOP PREMISES /ENG'G. SVCE","MTM","9485 AERO DRIVE, SAN DIEGO, CA. 92123","0.0","7/1/2018","","FMD","7160.94"
"N506PM","CITY--ENG & CAP PROJECTS FROM AIRPORTS","","","","MOU","REVENUE TO AIRPORT R33995EXPENSE TO E&CP (GENERAL FUND)","MTM","9485 AERO DRIVE","0.0","7/1/2018","","",""
"N506PM","CITY--PARKS AND RECREATION DEPARTMENT","Parks and Recreation Department","","92123","MOU","Parking Lot","Normal","9485 Aero Drive","0.0","12/19/2023","12/18/2033","FMD","18459.66"
"N508PA","94TH AERO SQUADRON SD INC.","94TH AERO SQUADRON SD INC.","","92123","Lease","VIEWING AREA BEHIND 94TH AERO SQUADRON RESTAURANT","Normal","8885 BALBOA AVENUE","0.0","7/17/2025","7/31/2028","FMD","1000.0"
"N508PA","A/V CONSULTING","A/V CONSULTING","","92124","Lease","AVIATION-GROUND","MTM","3750 JOHN J. MONTGOMERY DR.","0.0","7/1/2019","","FMD","525.0"
"N508PA","AIR CENTER MYF, LLC","AIR CENTER MYF, LLC","","92123","Lease","General Aviation and incidental allowed uses. FIXED BASE OPERATOR","Normal","3753 John J. Montgomery Drive, Suite 2","0.0","3/8/2025","3/7/2075","",""
"N508PA","ALLEY, JOHN C","ALLEY, JOHN C","","97436-8704","Agreement","AVIATION GROUND","MTM","3750 JOHN J MONTGOMERY DR SD CA 92123","0.0","4/15/2002","","FQD","378.0"
"N508PA","ALPS HOSPITALITY INC","ALPS HOSPITALITY INC","","92123","Lease","HOTEL OPERATION","Normal","8110 Aero Drive, San Diego, CA 92123","0.0","01/26/2026","01/31/2076","FMD","83333.33"
"N508PA","AMBLER ROBERT/01","ROBERT AMBLER","","92106","Agreement","GROUND AVIATION ","MTM","3750 JOHN J MONTGOMERY DR SD CA 92123","0.0","6/25/2015","","FYD","1512.0"
"N508PA","AMBLER ROBERT/02","AMBLER ROBERT/02","","92106","Agreement","GROUND AVIATION ","MTM","3750 JOHN J MONTGOMERY DR SD CA 92123","0.0","9/7/1999","","FMD","126.0"
"N508PA","ARMI, LAURENCE/02","ARMI, LAURENCE","","92007","Lease","AVIATION GROUND","Normal","3750 JOHN J MONTGOMERY DR SD CA","0.0","9/1/2019","6/30/2032","",""
"N508PA","ASHLEY, DALLAS","ASHLEY, DALLAS","","92007","Lease","MARIGOLD 8B-1D","Normal","MONTGOMERY-GIBBS EXECUTIVE AIRPORT","0.0","12/1/2020","6/30/2032","FMD","95.29"
"N508PA","AVFUEL CORPORATION/1","AVFUEL CORPORATION/1","","48108","Permit","FLOWAGE FEE-FUEL DELIVERY","MTM","MONTGOMERY-GIBBS EXECUTIVE AIRPORT","0.0","3/1/2023","","PMR","0.0"
"N508PA","BARLOW, WILLIAM","WILLIAM R. BARLOW","","92123","Agreement","AVIATION GROUND PARKING","MTM","MONTGOMERY-GIBBS EXECUTIVE AIRPORT","0.0","10/1/2022","","FMD","126.0"
"N508PA","BASSO FAMILY VENTURES LLC","BASSO FAMILY VENTURES LLC","","91941-4489","Lease","AVIATION - GROUND","Normal","3750 JOHN J. MONTGOMERY DR","0.0","7/1/2017","6/30/2032","FYD","2878.92"
"N508PA","BEATY, GREGG","BEATY, GREGG","","92131-3648","Lease","Airports/Hangar","Normal","3750 John J. Montgomery Drive","0.0","10/1/2023","6/30/2032","FYD","1586.76"
"N508PA","BEHROOZI, POOYA","BEHROOZI, POOYA","","92101","Lease","AVIATION - GROUND","MTM","3750 JOHN J MONTGOMERY DR","0.0","9/20/2019","","FMD","143.96"
"N508PA","BELL INVESTMENT GROUP LLC","BELL INVESTMENT GROUP LLC","","92123","Lease","RETAIL CENTER","Normal","8690 AERO DRIVE","0.0","2/3/2025","2/2/2028","FMD","2094.82"
"N508PA","BITON, LIAD","BITON, LIAD","","92122","License","FLATTOP WEST 5B-1B","Normal","3750 JOHN J.MONTGOMERY DR","0.0","8/1/2025","7/31/2028","FMD","143.96"
"N508PA","BORDEN, MICHAEL C.","BORDEN, MICHAEL C.","","92020","Lease","AVIATION - GROUND","Normal","3750 JOHN J MONTGOMERY DR","0.0","7/1/2017","6/30/2032","FYD","1790.76"
"N508PA","BRANCO, DANIEL","BRANCO, DANIEL","","92130","Lease","AVIATION - GROUND","MTM","3750 JOHN J MONTGOMERY DR SD CA 92123","0.0","3/1/2022","","FMD","126.0"
"N508PA","BRASIL, JOHN/01","BRASIL, JOHN/01","","91945","Lease","AVIATION GROUND SPACE","Normal","MONTGOMERY-GIBBS EXECUTIVE AIRPORT ","0.0","2/1/2021","6/30/2032","FMD","204.24"
"N508PA","BRASIL, JOHN/02","BRASIL, JOHN","","91945-3139","Lease","AVIATION - GROUND","MTM","3750 JOHN J MONTGOMERY DR","0.0","2/19/2002","","FMD","134.88"
"N508PA","BRESLIN, DENIS","BRESLIN, DENIS","","92109-6037","MTM","AVIATION GROUND","MTM","MONTGOMERY-GIBBS EXECUTIVE AIRPORT","0.0","8/1/2021","","FMD","525.0"
"N508PA","BROWN, BRIAN","BROWN, BRIAN","","92123-3245","Lease","AVIATION GROUND","Normal","3750 JOHN J MONTGOMERY DR SD CA 92123","0.0","7/1/2017","6/30/2032","FMD","153.39"
"N508PA","BUCCIARELLI, TAZIO ERIC","BUCCIARELLI, TAZIO ERIC","","92123-3033","Lease","FLATTOP WEST 5B-3D","Normal","3750 JOHN J MONTGOMERY DR","0.0","4/1/2019","6/30/2032","FMD","89.78"
"N508PA","BYERS, STEVEN J/01","BYERS, STEVEN J/01","","92107","MTM","MONTHLY AIRCRAFT PARKING","MTM","3750 JOHN J MONTGOMERY DR SD CA 92123","0.0","4/19/2010","","FMD","145.92"
"N508PA","BYERS, STEVEN J/02","BYERS, STEVEN J/02","","92107","Agreement","AVIATION GROUND","MTM","3750 JOHN J MONTGOMERY DR SD CA 92123","0.0","4/19/2010","","FMD","133.56"
"N508PA","CARLSBAD AIR SERVICE","CARLSBAD AIR SERVICE","","92123","Sublease","MAINTENANCE HANGAR FOR AIRCRAFTS (Hangar #1 Lot 8A)","Normal","KEARNY MESA","0.0","3/1/2026","2/28/2029","FMD","8880.0"
"N508PA","CARLSBAD AIR SERVICE INC/02","CARLSBAD AIR SERVICE INC","","92123-1729","MTM","FLATTOP WEST 5B-2A","MTM","3750 JOHN J MONTGOMERY DR SD CA 92123","0.0","6/1/2021","","FMD","126.0"
"N508PA","CARLSBAD AIR SERVICE INC/03","CARLSBAD AIR SERVICE INC","","92123-1729","MTM","FLATTOP WEST 5B-1A","MTM","3750 JOHN J MONTGOMERY DR SD CA 92123","0.0","6/1/2021","","FMD","126.0"
"N508PA","CARLSON, JEFFREY","CARLSON, JEFFREY","","92037","Lease","AVIATION - GROUND","MTM","3750 JOHN J. MONTGOMERY DR","0.0","3/1/2018","6/30/2032","FMD","110.46"
"N508PA","CARTER RANDY","CARTER RANDY","","92064","Lease","FLATTOP EAST 5B-5H","Normal","MONTGOMERY-GIBBS EXECUTIVE AIRPORT","0.0","2/1/2023","6/30/2032","FYD","1634.88"
"N508PA","CAVITT, PETE","CAVITT, PETE","","92104-5359","Lease","AVIATION - GROUND","Normal","3750 JOHN J MONTGOMERY DR","0.0","7/1/2017","6/30/2032","FYD","2153.4"
"N508PA","CHAREUNSOUK, KHAM & THANATHONE","CHAREUNSOUK, KHAM & THANATHONE","","92123","Lease","RETAIL- THAI CUISINE RESTAURANT","Normal","8690 AERO DRIVE, SUITE 114","0.0","3/11/2024","3/10/2029","FMD","4537.16"
"N508PA","CITY-- E&CP (COMBINED WITH PUD)","CITY-- E&CP & PUD","","92123","MOU","OFFICE SPACE","Normal","8525 GIBBS DRIVE, SUITE 120","0.0","8/1/2024","7/31/2034","FMD","8964.09"
