"site_code","lessee_name","lessee_company","lessee_DBA","address_zip","lease_record_type","lease_description","lease_status","lease_location_name","nonprofit_lessee","date_effective","date_sched_termination","rent_code","cost_line_amt_USD"
"A001WR","NEAL, ROBERT","NEAL, ROBERT","","92065","Lease","AGRICULTURE & CATTLE GRAZING","Held Over","PAMO VALLEY","0.0","4/18/2019","4/17/2022","",""
"A001WR","SAN DIEGUITO RIVER PARK JPA/15","SAN DIEGUITO RIVER PARK JPA","","92025","Permit","MAINTENANCE & RESTORATION","Normal","PAMO VALLEY","0.0","12/1/2016","11/30/2036","",""
"A007WW","PACIFIC TELEPHONE/01","PACIFIC TELEPHONE/01","AT&T","75202-4206","Permit","TELEPHONE CABLE","MTM","SUTHERLAND DAM, CITY RESIDENCE","0.0","3/12/1974","","",""
"ADMIN","AG ESSENTIAL HOUSING CA 2, LP","AG ESSENTIAL HOUSING CA 2, LP","","92008","Agreement","OTAY 2ND PIPELINE EASEMENT","MTM","CHULA VISTA, COUNTY OF SAN DIEGO","0.0","11/4/2021","","",""
"ADMIN","WESTFIELD CORPORATION, INC.","Spinoso Real Estate Group","NORTH COUNTY FAIR","13212","Agreement","SHOPPING CENTER","Normal","I-15& VIA RANCHO PARKWAY ESCONDIDO","0.0","4/8/1980","6/30/2033","FMD","8333.33"
"ADMIN","YWCA OF SD COUNTY","YWCA OF SD COUNTY","","92101-5522","Lease","TRANSITIONAL HOUSING 5550","Normal","FRIARS RD, MISSION VALLEY","1.0","5/1/2026","4/30/2036","FMD","402.0"
"BLDG","KIDS CORNER INC","KIDS CORNER INC","","92103-1946","Lease","CHILD CARE CENTER","MTM","1425 WASHINGTON PL SD CA 92103","0.0","3/1/2002","2/29/2012","FMD","1424.44"
"BLDG","YMCA/06 PENASQUITOS","YMCA/06 PENASQUITOS","","92123","Operating","RECREATIONAL FACILITY","Normal","FAIRGROVE LANE","1.0","3/2/1994","3/1/2044","",""
"C601WR","SAN DIEGUITO RIVER PARK JPA/11","SAN DIEGUITO RIVER PARK JPA/11","","92025-2301","Lease","PEDESTRIAN BRIDGE","Normal","HODGES RESERVOIR, WEST OF I-15","0.0","11/1/2007","10/31/2032","FYD","525.4"
"C601WR","SANTA FE IRRIGATION DISTRICT/02","SANTA FE IRRIGATION DISTRICT","","92067","Permit","MOUNTED WEATHER STATION","Normal","HODGES RESERVOIR","0.0","5/18/2017","5/17/2047","",""
"C601WW","SANTA FE IRRIGATION DISTRICT","SANTA FE IRRIGATION DISTRICT","","92067","Permit","INSTALL & MAINTAIN  WATER QUALITY PROFILER","Normal","LAKE HODGES RESERVOIR","0.0","7/1/2016","6/30/2046","",""
"C701MM","COUNTY OF SD ENVIRONMENTAL HEALTH","COUNTY OF SD ENVIRONMENTAL HEALTH","","92123-1215","Permit","BREED & RAISE MOSQUITO FISH","Held Over","14103 HIGHLAND VALLEY RD","0.0","5/1/2022","4/30/2025","",""
"C701P2","STATE OF CA/DEPT OF PARKS & REC","STATE OF CA/DEPT OF PARKS & REC","","92110","Permit","OPERATION AND MAINTENANCE OF STATE HISTORICAL MONUMENT","Held Over","POR RHO SAN BERNARDO","0.0","4/1/1988","3/31/1993","FYD","100.0"
"C701WW","AM-SOD INC","AM-SOD INC","","92027","Lease","GROWING SOD OR FIELD CROPS","Held Over","","0.0","4/1/1996","3/31/2026","FQD","34453.13"
"C701WW","BRAMMER FARMS LLC","BRAMMER FARMS LLC","","92025","Lease","ORGANIC ROW CROP FARMING","Held Over","20505 SAN PASQUALVALLEY RD SD ","0.0","3/1/2023","2/28/2026","FQD","24720.0"
"C701WW","CITY OF ESCONDIDO","CITY OF ESCONDIDO","","92025-2709","Lease","GOLF COURSE","Normal","SAN PASQUAL","0.0","6/1/1988","6/1/2050","FYD","38178.47"
"C701WW","CITY OF POWAY/02","CITY OF POWAY","","92074-0789","Agreement","ESTABLISH, MONITOR AND MAINTAiN A TRAIL. ","MTM","14225 HIGHLAND VALLEY RD., SPV","0.0","1/20/2011","","",""
"C701WW","ENVIRONMENTAL DESIGN CALIFORNIA INC","ENVIRONMENTAL DESIGN CALIFORNIA INC","","92025","Lease","IN-GROUND TREE & SHRUB NURSERY","Normal","12450 HIGHLAND VALLEY RD ","0.0","5/1/2014","4/30/2034","PQR","0.0"
"C701WW","EVERGREEN NURSERY DISTRIBUTORS, INC.","EVERGREEN NURSERY DISTRIBUTORS, INC.","","92026","Lease","NURSERY","Held Over","14225 HIGHLAND VALLEY ROAD ESC 92025","0.0","4/16/1986","4/15/2006","FQD","20766.5"
"C701WW","FOODSHED COOPERATIVE INC","FOODSHED COOPERATIVE INC","","92105-1607","Agreement","FRUIT TREES","Normal","21250 & 24330 SAN PASQUAL RD. ESCONDIDO, CA 92027 ","0.0","6/6/2025","6/5/2026","",""
"C701WW","GIUMARRA OF ESCONDIDO","THE GIUMARRA COMPANIES","","92027-7104","Lease","PACKING SHED & OFFICE/HOUSE","Held Over","SAN PASQUAL VALLEY","0.0","1/1/1992","12/31/2021","FQD","23092.72"
"C701WW","HENRY RANCH ESCONDIDO, LP","HENRY RANCH ESCONDIDO, LP","","92029-2054","Lease","AVOCADO FARM","Normal","BANDY CANYON RD, SAN PASQUAL VALLEY","0.0","7/13/2012","7/12/2032","FQD","8200.0"
"C701WW","HUNTLEY, PATRICIA","HUNTLEY, PATRICIA","","92025-3716","Agreement","ANIMAL CORRALS & SHEDS","MTM","17917 BANDY CANYON RD.","0.0","7/1/1997","","FMD","150.0"
"C701WW","KONYN, FRANK J","KONYN, FRANK J","KONYN DAIRY","92027","Lease","DAIRY","Held Over","SAN PASQUAL, POR T12S, R1W","0.0","7/23/1979","3/12/2008","FMD","1477.76"
"C701WW","KONYN, FRANK/ 05","KONYN, FRANK/ 05","","92027-7105","Lease","GROWING & MARKETING FLOWERS","Held Over","SAN PASQUAL VALLEY","0.0","8/1/1992","7/31/2012","FQD","15201.88"
"C701WW","KONYN, FRANK/02","KONYN, FRANK/02","","92027","House Rental","SINGLE STORY RESIDENCE, SAN PASQUAL VALLEY","MTM","17425 BRANDY CANYON ROAD","0.0","4/1/2010","","FMD","633.34"
"C701WW","KONYN, FRANK/03","KONYN, FRANK/03","","92027","Permit","CULTIVATION OF HAY FOR LIVESTOCK","Held Over","BANDY CANYON RD, SAN PASQUAL VALLEY","0.0","5/1/2013","4/30/2016","FMD","1762.5"
"C701WW","KONYN, FRANK/04","KONYN, FRANK/04","","92027-7105","House Rental","SINGLE STORY RESIDENCE","MTM","17407 BANDY CANYON RD. ","0.0","8/1/2013","","FMD","633.34"
"C701WW","NEW CINGULAR WIRELESS/WILD ANIMAL PARK","NEW CINGULAR WIRELESS PCS/WILD ANIMAL PARK","","30319","Lease","COMMUNICATIONS FACILITY","Held Over","15500 SAN PASQUAL VALLEY RD","0.0","2/1/2011","1/31/2021","FYD","46738.67"
"C701WW","ORFILA VINEYARDS","ORFILA VINEYARDS","","92025-7833","Lease","AGRICULTURE/ WINERY","Extended","13455 SAN PASQUAL ROAD","0.0","11/1/1999","11/30/2029","PMR","7442.96"
"C701WW","PAK AND PARK, LLC","PAK AND PARK, LLC","HODGES GOLF IMPROVEMENT CENTER","92025-8016","Lease","GOLF DRIVING RANGE","MTM","12675 SUNSET DRIVE, SD","0.0","7/1/2000","6/30/2025","PQR","0.0"
"C701WW","PALOMAR ENTERPRISES INC/EINER BROS INC","PALOMAR ENTERPRISES INC/EINER BROS INC","EINER BROS INC","92046-2947","Permit","MAINT. BARN/CORRAL/USE ROAD","MTM","SAN PASQUAL VALLEY","0.0","11/1/1989","","FYD","1200.0"
"C701WW","PARRISH, TERRY","PARRISH, TERRY","","92027","Agreement","RESIDENTIAL/TRAIN.SHEEP DOGS","Held Over","15450 OLD SAN PASQUAL RD.#7","0.0","4/1/1992","3/31/1995","FMD","1125.0"
"C701WW","PINERY CHRISTMAS TREES, INC.","PINERY CHRISTMAS TREE, INC.","","92196","Permit","SEASONAL CHRISTMAS TREE/PUMPKIN SALES, STORAGE OF ORNAMENTAL TREES","Held Over","13421 HIGHLAND VALLEY ROAD","0.0","4/1/2010","3/31/2013","FQD","4375.0"
"C701WW","PINERY, LLC","THE PINERY, LLC","","92025-2322","Lease","NURSERY","Normal","13701 HIGHLAND VALLEY RD","0.0","6/1/2011","5/31/2031","PQR","0.0"
"C701WW","QUINTERO, ARCELIA","QUINTERO, ARCELIA","","92025","House Rental","RESIDENTIAL","MTM","17178 BANDY CANYON RD","0.0","2/1/2011","","FMD","535.9"
"C701WW","QUINTERO, BENJI","QUINTERO, BENJI","","92025","House Rental","RESIDENTIAL","MTM","17082 BANDY CANYON RD","0.0","2/1/2011","","PYR","0.0"
"C701WW","QUINTERO, JOSE Z.","QUINTERO, JOSE ZAVALA","","92025","House Rental","RESIDENTIAL","MTM","17078 BANDY CANYON RD","0.0","2/1/2011","","FMD","535.9"
"C701WW","QUINTERO, LUIS & RITA","LUIS & RITA QUINTERO","","92069","House Rental","RESIDENTIAL","MTM","17070 BANDY CANYON RD","0.0","11/4/2016","","FMD","535.9"
"C701WW","QUINTERO, MARTIN","QUINTERO, MARTIN","","92025-3606","House Rental","HOUSE RENTAL","MTM","16777 BANDY CANYON RD","0.0","6/1/2011","","FMD","2358.0"
"C701WW","RANCHO DE LA LOMA, LLC","RANCHO DE LA LOMA, LLC","","92033","Lease","GROWING AVOCADOS & STORAGE","Held Over","SAN PASQUAL VALLEY (64 ACRES)","0.0","1/1/2009","12/31/2023","FQD","3750.0"
"C701WW","S&S SEEDS CALIFORNIA LP","S&S SEEDS CALIFORNIA LP","","92084-6059","License","SEED COLLECTION ACTIVITIES","Normal","COUNTY OF SD, EAST OF LAKE CUYAMACA","0.0","7/8/2025","7/7/2028","",""
"C701WW","SAN DIEGUITO RIVER PARK JPA/08","SAN DIEGUITO RIVER PARK JPA/08","","92025","Permit","STAGING AREA","MTM","11000 HIGHLAND VALLEY ROAD","0.0","10/14/1999","10/13/2002","",""
"C701WW","SAN DIEGUITO RIVER PARK JPA/09","SAN DIEGUITO RIVER PARK JPA/09","","92025","Permit","MAINTENANCE PUBLIC TRAIL","Held Over","SAN PASQUAL VALLEY","0.0","2/5/2001","2/5/2004","",""
"C701WW","SAN DIEGUITO RIVER VALLEY CONSERVANCY","THE SAN DIEGUITO RIVER VALLEY CONSERVANCY","","92109","Permit","TREATMENT OF NON-NATIVE INVASIVE PLANTS","Held Over","SAN PASQUAL VALLEY/ LAKE HODGES RESERVOIR","0.0","12/15/2015","12/14/2018","",""
"C701WW","SAN PASQUAL VALLEY RANCH, LLC","SAN PASQUAL VALLEY RANCH, LLC","","92024-4372","Lease","HORSE STABLES, NURSERY","Held Over","2460 CLOVERDALE RD, ","0.0","10/1/2005","9/30/2017","PMR","2814.18"
"C701WW","SDG&E/09","SDG&E/09","","92112-9831","Permit","ACCESS ROAD","MTM","NEAR HIGHLAND VALLEY ROAD","0.0","9/11/1986","","",""
"C701WW","SDG&E/37","SDG&E/ 37","","92112","Permit","CONSTRUCTION WORK AREA/ ACCESS","Normal","LAKE HODGES AREA, SAN PASQUAL","0.0","11/3/2020","8/2/2026","",""
"C701WW","SDG&E/39","SDG&E","","92123","Permit","TEMPORARY CONSTRUCTION AREA","Normal","SAN PASQUAL","0.0","11/3/2020","7/2/2026","",""
"C701WW","SDSU","SDSU","","92182","Permit","SODAR UNITS & ACCESS TRAIL","Held Over","MULE HILL TRAIL ALONG BEAR VALLEY PKWY","0.0","2/22/2017","2/21/2022","",""
"C701WW","SLOOP & WITMAN/01","SLOOP & WITMAN/01","RANCHO VISTA MONTANAS","92033","Lease","CITRUS & GENERAL AGRICULTURE 153 acres ","Held Over","SAN PASQUAL VALLEY (154 ACRES)","0.0","1/1/1987","12/31/2016","FQD","2494.64"
"C701WW","SONGER, LYLE & KODY","SONGER, LYLE & KODY","","92027","Permit","HOUSE/ LIVESTOCK/ STORAGE GRAIN/ AGRIC","Held Over","2280 CLOVERDALE RD. SAN PASQUAL VALLEY","0.0","6/1/2013","5/31/2016","FMD","1547.98"
"C701WW","STAGE RANCH FARM MANAGEMENT LLC","STAGE RANCH FARM MANAGEMENT LLC","","92590","Agreement","AGRICULTURE","Extended","2185 CLOVERDALE RD ESCONDIDO CA 92027","0.0","6/5/2025","6/4/2027","FQD","3500.0"
"C701WW","STATE OF CA/MONUMENT PARK","STATE OF CA/MONUMENT PARK","","92110","Lease","HISTORICAL PARK","Normal","SAN PASQUAL VALLEY","0.0","7/24/1978","7/23/2033","",""
"C701WW","THREE C GROWERS","THREE C GROWERS","","92025","Lease","NURSERY","Held Over","SAN PASQUAL VALLEY","0.0","5/1/1992","4/30/2007","FQD","8053.89"
"C701WW","WEST COAST TURF","WEST COAST TURF","","92261-4563","Lease","GROW & HARVEST SOD","Normal","SAN PASQUAL VALLEY","0.0","7/1/2020","6/30/2050","PYR","249780.0"
"C701WW","WITMAN RANCH INC/ 25 ACRES","WITMAN RANCH INC/25 AC","","92033","Lease","TREE CROPS","Held Over","SAN PASQUAL VALLEY (25 ACRES)","0.0","1/1/1987","12/31/2016","FQD","900.0"
"C701WW","WITMAN RANCH INC/02 ","WITMAN RANCH INC/02","","92033-1959","Lease","GROWING CITRUS AND AVOCADO","Normal","NE END OF SAN PASQUAL VALLEY (282 ACRES)","0.0","1/1/2010","12/31/2029","FQD","17625.0"
"C701WW","WITMAN RANCH INC/19 AC","WITMAN RANCH INC","","92033","Lease","TREE CROPS","Held Over","SAN PASQUAL VALLEY (19 ACRES)","0.0","1/1/1992","12/31/2016","FQD","1000.0"
"C701WW","WITMAN RANCH INC/30 AC","WITMAN RANCH INC/30 AC","RIVER RUN RANCH","92033","Lease","TREE CROPS","Held Over","SAN PASQUAL VALLEY (30 ACRES)","0.0","1/1/1987","12/31/2016","FQD","900.0"
"C701WW","ZOOLOGICAL SOCIETY OF SD","ZOOLOGICAL SOCIETY OF SD","WILD ANIMAL PARK","92112-0551","Operating","GAME PRESERVE","MTM","15500 SAN PASQUAL VALLEY RD., ","1.0","2/13/1969","","FYD","101691.71"
"C701WW","ZOOLOGICAL SOCIETY OF SD/02","ZOOLOGICAL SOCIETY OF SD","","92025","Permit","BROWSE FARM","Held Over","SAN PASQUAL VALLEY","1.0","12/2/2010","12/1/2013","FQD","17050.0"
"C701WW","ZOOLOGICAL SOCIETY OF SD/03","ZOOLOGICAL SOCIETY OF SD/03","WILD ANIMAL PARK(PO JX02074)","92027-7017","Permit","DRILL & OPERATE A WELL","MTM","SAN PASQUAL VALLEY, MONUMENT ROAD","1.0","10/5/1982","","PQR","0.0"
"C703WM","CITY OF ESCONDIDO/02","CITY OF ESCONDIDO/02","","92025","Agreement","GOLF COURSE","Normal","SIERRA LINDA DR & SAN PASQUAL RD","0.0","1/1/1994","12/31/2029","PYR","0.0"
"CITY","550 CORPORATE CENTER INVESTMENT GROUP INC","550 CORPORATE OWNER LLC","","92101","Lease","OFFICE SPACE","Normal","550 WEST “C” ST. STE 1200 & 1300 SD CA 92101","0.0","9/23/2024","8/31/2030","",""
"CITY","CITY/ COUNTY OF SAN DIEGO, A POLITICAL SUBDIVISION OF THE STATE OF CALIFORNIA","COUNTY OF SAN DIEGO, A POLITICAL SUBDIVISION OF THE STATE OF CALIFORNIA","","92114","License","SATELLITE OFFICE","Normal","5101 MARKET ST. SD CA 92114","0.0","2/15/2024","2/14/2034","",""
"CITY","CITY/ LIBRARY DEPARTMENT","LIBRARY DEPARTMENT","","92101","Agreement","PARKING MANAGEMENT SERVICES","Normal","330 PARK BLVD. SD CA 92101","0.0","1/1/2025","12/31/2029","",""
"CITY","CITY/ US DEPT OF INTERIOR","NATIONAL PARK SERVICE","","92106-3601","Permit","ACCESS ROAD TREATMENT PLANT","Normal","CABRILLO NATIONAL MONUMENT ROAD","0.0","10/1/2025","10/31/2026","",""
"CITY","CITY/1401-85 E STREET LP","1401-85 E STREET LP","","92127","Lease","Renting warehouse for Police property and evidence storage","Extended","Jerome’s Warehouse","0.0","1/1/2022","12/31/2027","FMD","14529.0"
"CITY","CITY/52 BLUE FALCON, LLC","52 BLUE FALCON, LLC","","92150","Joint Use","Parking and Access","Normal","6650 Montezuma Rd.","0.0","12/6/2019","1/5/2040","FMD","1000.0"
"CITY","CITY/600 B STREET SAN DIEGO OWNER LLC","600 B STREET SAN DIEGO OWNER LLC","","94111","Lease","OFFICE SPACE FOR CITY EMPLOYEES","Extended","600 ‘B’ ST","0.0","4/1/2020","9/30/2029","",""
"CITY","CITY/AFJR PARTNERSHIP","CITY/AFJR PARTNERSHIP","","92101","Lease","PUBLIC RESTROOM","Normal","EAST SIDE OF 6TH AVE, SOUTH OF L STREET","0.0","12/6/1995","12/5/2094","",""
"CITY","CITY/AG-PCPI SKYPARK OWNER LP","AG-PCPI SKYPARK OWNER LP","","92123","Lease","INJURY REHABILITATION / HEALTH & WELLNESS","Normal","9325 SKY PARK CT  STE 100 SD CA 92123","0.0","10/31/2023","10/31/2030","",""
"CITY","CITY/B.H. CAMINO DEL RIO LLC","","","","Lease","GENERAL OFFICE & ADMIN. PURPOSES","Extended","4025 CAMINO DEL RIO SOUTH STE 104 SD, CA 92108","0.0","9/1/2017","8/31/2026","FMD","345.26"
"CITY","CITY/BALBOA BUILDING OWNER LLC","BALBOA BUILDING OWNER LLC","","90051-4546","Lease","OFFICE SPACE","Normal","9444 BALBOA AVE SD CA 92123","0.0","3/28/2022","9/30/2028","",""
"CITY","CITY/BAY CITY PLAZA/PALM AVENUE","CITY/BAY CITY PLAZA/PALM AVENUE DBA POLICE SATELLITE OFFICE","","92154","Lease","POLICE SATELLITE OFFICE","MTM","1515 PALM AVENUE","0.0","9/15/1997","","",""
"CITY","CITY/BREITBARD PROPERTIES LLC","BREITBARD PROPERTIES LLC","","92101-1507","Lease","TEMPORARY HOUSING SHELTERS","Extended","1710 IMPERIAL AVE","0.0","4/1/2019","6/30/2026","FMD","5464.0"
"CITY","CITY/CALICO LLC & CATITUDE LLC","CALICO LLC AND CATITUDE LLC","","92127","City Use","FIRE/RESCUE MAINTENANCE FACIILITY","Normal","OTHELLO","0.0","10/1/2017","9/30/2032","FMD","79807.0"
"CITY","CITY/CCP 1200, LLC","CITY/CCP 1200, LLC","","92130","Lease","GENERAL OFFICE SPACE","Normal","CIVIC CENTER PLAZA","0.0","3/13/2015","5/31/2035","FMD","345624.0"
"CITY","CITY/COUNTY OF SD","CITY/COUNTY OF SD","COUNTY OF SD","92101","Agreement","RENT ADMIN., COWLES MTN","MTM","COWLES MT. (POR)","0.0","3/9/1982","","",""
"CITY","CITY/COUNTY OF SD/02","COUNTY OF SD","","92123","License","FIRE-RESCUE & EMS SERVICES","MTM","17701 SAN PASQUAL VALLEY ROAD","0.0","9/16/2016","9/15/2021","",""
"CITY","CITY/COUNTY OF SD/03","CITY/COUNTY OF SD","","92123","MOU","USE OF EMERGENCY VEHICLE OPERATIONS COURSE","Normal","East Otay Mesa, APN 648-070-03","0.0","10/19/2019","10/31/2034","",""
"CITY","CITY/DEBOLT, DERRICK, MCFARLAND PROPERTIES, LLC","CITY/DEBOLT, DERRICK, MCFARLAND PROPERTIES, LLC","","92129","Lease","Transitional Storage Facility for the Homeless","Extended","116 S. 20th Street, San Diego","0.0","7/1/2021","6/30/2027","FMD","16106.8"
"CITY","CITY/DRISCOLL MARINA","","","","Lease","LAB, OFFICE & 2 BOAT SLIPS.  Office Suites 105 and 107; Boat Slips 15 and 16 of Pier 5","MTM","Driscoll Marina","0.0","7/1/2011","6/30/2016","FMD","3462.39"
"CITY","CITY/EAST COUNTY ADVANCED WATER PURIFICATION JPA","CITY/EAST COUNTY ADVANCED WATER PURIFICATION JPA","","92123","Agreement","ODOR CONTROL AND MONITORING ACCESS","MTM","8810MISSION GORGE RD SANTEE, CA 92071","0.0","10/13/2025","","",""
"CITY","CITY/FTC VENTURES LLC","FTC VENTURES LLC","","92130","License","CONSTRUCTION STAGING AREA","Normal","RACHAEL AVE. BETWEEN E. 20TH & CUMBERLAND ST. NATIONAL CITY, CA 91950","0.0","2/22/2024","2/21/2027","",""
"CITY","CITY/H.G. FENTON PROPERTY COMPANY","H.G. FENTON PROPERTY COMPANY","","92108","Lease","OFFICE & WAREHOUSE","Normal","3554 RUFFIN RD S. STE A SD, CA 92123","0.0","8/28/2018","4/17/2029","FMD","30932.0"
"CITY","CITY/HERO LLC","CITY/HERO LLC","","92101","Lease","HOMELESS HOUSING","Extended","1801 LOGAN AVE SD CA 92101","0.0","11/17/2022","6/30/2026","",""
"CITY","CITY/KYOCERA INTERNATIONAL INC","KYOCERA INTERNATIONAL INC","","92123","Lease","STORAGE OF WASTE BINS","Normal","8775 BALBOA AVE, SD, CA 92123","0.0","2/1/2025","1/31/2028","",""
"CITY","CITY/MOBILE HOMES ACCEPTANCE CORP.","","","","Lease","POLICE ADMINISTRATION OFFICE","MTM","303 N. 47TH STREET","0.0","4/1/1995","","",""
"CITY","CITY/NEW WORLD LTD (MERCHANT)","","","","Lease","Office for SDPD use.checks payable to and managed by:Merchant Property Management619 299 4024Address change 4/18/08 per letter","MTM","5348 UNIVERSITY AVENUE, SD, CA 92105","0.0","5/1/2008","4/30/2013","FQD","2375.0"
"CITY","CITY/PACIFIC BELL/02","CITY/PACIFIC BELL/02","","92103","Lease","COMMUNICATIONS SHELTER","Held Over","BLACK MOUNTAIN POR OF ","0.0","4/1/1991","3/31/2021","",""
"CITY","CITY/PACIFIC TELEPHONE","CITY/PACIFIC TELEPHONE","","92101","Agreement","SATELLITE RECVR/COMM FACIL","MTM","BLACK MOUNTAIN/POR","0.0","1/18/1979","","",""
"CITY","CITY/PROVIDENCE CHESAPEAKE LLC","CITY/PROVIDENCE CHESAPEAKE LLC","","92024","Lease","Office Space","Extended","9573 Chesapeake Drive","0.0","1/1/2017","4/30/2027","FMD","2550.0"
"CITY","CITY/RAVEN 411 LLC","RAVEN 411 LLC","","92102","Lease","Industrial space for Park & Rec’s vehicles and equipment.","Normal","411 RAVEN STREET","0.0","6/1/2024","5/31/2029","",""
"CITY","CITY/ROCK CHURCH INC","ROCK CHURCH INC","","92106","Agreement","SDPD SATELLITE OFFICE","MTM","4001 ELCAJON BLVD. ","0.0","9/1/2017","8/31/2022","",""
"CITY","CITY/RUFFIN LLC","","","","Agreement","OFFICE LEASE","Extended","9370 Chesapeake, Suite 100 &150 San Diego, CA 92123","0.0","6/01/2008","5/31/2030","FMD",""
"CITY","CITY/SD COMM COLLEGE DIST","CITY LIBRARY ADMINISTRATION","","","Lease","MTN/BECKWORTH BRANCH LIBRARY","Normal","721 SAN PASQUAL ","0.0","6/25/1975","6/25/2074","",""
"CITY","CITY/SD COMM COLLEGE DIST/01","CITY/SD COMM COLLEGE DIST","","92108","Lease","Records Storage in Emergency","MTM","San Diego City College Gym &  Handball CT ","0.0","11/25/1988","","",""
"CITY","CITY/SD FAMILY HOUSING LLC (US NAVY)","CITY/SD FAMILY HOUSING LLC","","92123","License","POLICE STOREFRONT","Extended","4439-4440 OLNEY STREET","0.0","6/1/2012","5/31/2028","",""
"CITY","CITY/SD HOUSING COMMISSION","","","","Lease","","Held Over","Smart Corner","0.0","1/1/2021","12/31/2025","",""
"CITY","CITY/SD UNIFIED SCHOOL DISTRICT","","","","Lease","RECREATIONAL FIELD HOUSE","Normal","1425 W. Washington Place ","0.0","3/1/2002","2/28/2027","",""
"CITY","CITY/SD UNIFIED SCHOOL DISTRICT/02","CITY/SD UNIFIED SCHOOL DISTRICT/02","","92101","Lease","LIBRARY","Normal","2875 OCEAN VIEW BLVD","0.0","12/9/2002","12/5/2052","",""
"CITY","CITY/SPORTS ARENA VILLAGE/02","","","","Lease","Peninsula COMMUNITY STOREFRONT","MTM","3750 SPORTS ARENA BLVD","0.0","12/30/1998","","",""
"CITY","CITY/STATE OF CA/DEPT OF TRANS","CITY/STATE OF CA/DEPT OF TRANS","NEIL GOOD DAY CENTER","92110","Lease","EMERGENCY SHELTER/ FEEDING PROGRAM","Held Over","299 - 17TH STREET","0.0","11/1/1990","10/31/2022","",""
"CITY","CITY/STATE OF CA/DEPT OF TRANS/02","CITY/STATE OF CA/DEPT OF TRANS/02","","95816-3819","Lease","CHICANO PARK","Held Over","LOGAN AVE & DEWEY ST","0.0","3/1/1970","2/29/2000","",""
"CITY","CITY/STATE OF CA/DEPT OF TRANS/03","CITY/STATE OF CA/DEPT OF TRANS/03","","95816-3819","Lease","CHICANO PARK","Held Over","1960 NATIONAL AVENUE","0.0","10/1/1971","9/30/2001","",""
"CITY","CITY/US CUSTOMS & BORDER PROTECTION","CITY/US CUSTOMS & BORDER PROTECTION","","76040","Agreement","COMMUNICATIONS FACILITY","Normal","BLM LAND ON OTAY MOUNTAIN","0.0","10/1/2017","9/30/2037","",""
"CITY","CITY/US DEPT OF AGRICULTURE/02","CITY/US DEPT OF AGRICULTURE/02 DBA DESCANSO RANGER DISTRICT","","91901","Permit","COMMUNICATIONS EQUIP SHELTER","Held Over","LYONS PEAK","0.0","12/1/2004","12/31/2014","",""
"CITY","CITY/US NAVY","CITY/US NAVY","","92132-5179","License","COMM. IDENTIFICATION SIGN","MTM","BLUFFSIDE AVE & MISSION BAY DR (SWC)","0.0","11/1/1998","10/31/2003","",""
"CITY","CITY/US NAVY/02","CITY/US NAVY/02","","92101-2404","License","SMALL ARMS RANGE","MTM","NAVAL TRAINING CENTER/CAMP NIMITZ","0.0","4/1/1994","9/30/1999","",""
"CITY","CITY/US NAVY/05","CITY/US NAVY/05","","92132-5190","Lease","COMMUNICATION EQUIP SHELTER","Normal","POR MT SOLEDAD","0.0","9/1/2024","8/31/2029","",""
"CITY","CITY/WILSON HCF WISCONSIN 8 REPO LLC","CITY/450 B STREET INVESTORS LLC","","92101","Lease","Office Lease","Extended","451 A Street, Suite 1410","0.0","1/1/2020","11/30/2027","FMD","11828.38"
"CITY","CITY/YMCA","CITY/YMCA","","92123","Lease","RECREATION FACILITY","Normal","FAIRGROVE LANE","0.0","3/2/1994","3/1/2044","",""
"CITY","ENGINEERING & CAPITAL PROJECTS DEPT","ENGINEERING & CAPITAL PROJECTS DEPT","","92123","MOU","OFFICE SPACE & LAB AREA FOR ECP","MTM","9491 9515 AERO DR. SD CA 92123","0.0","7/1/2025","","",""
"CITY","I & G 525 B STREET INC","I & G 525 B STREET INC","","9210190084-5613","Lease","Public Utilities and Engineering moving to 525 B Street from 600 B Street","Extended","525 B Street","0.0","9/18/2013","3/31/2029","",""
"CITY","Imperial Marketplace Public Use Lease","Imperial Marketplace Public Use Lease","","00000","Lease","Public use lease for park and ride facilities servicing Marketplace retail and office space","MTM","Marketplace /Home Depot","0.0","1/7/2002","","",""
"CITY","Las Americas Public Use Lease Parcel A-1","Chelsea San Diego Finance LLC","","00000","Lease","Public use lease for park and ride facilities servicing Las Americas retail and office space","Normal","International Gateway of the Americas Project","0.0","7/1/2005","6/30/2035","FYD","496402.0"
"CITY","Las Americas Public Use Lease Parcel B/C","Chelsea San Diego Finance, LLC","","00000","Lease","Public use lease for park and ride facilities servicing Las Americas retail and office space","Normal","International Gateway of the Americas Project","0.0","7/1/2002","6/30/2032","FYD","811773.0"
"CITY","LINCOLN MILITARY PROPERTY MANAGEMENT ","LINCOLN MILITARY PROPERTY MANAGEMENT ","","92647","License","housing ","Normal","4439 oiney street san diego ca 92109","0.0","6/1/2023","5/31/2028","",""
"CITY","PROMENADE ACQUISITION LLC","PROMENADE ACQUISITION LLC","","92108","Agreement","SATELLITE OFFICE","MTM","8555 STATION VILLAGE LN STE 3F","0.0","10/25/2018","9/30/2020","",""
"CITY","RUFFIN-SD LLC","RUFFIN-SD LLC","","48334","Permit","EV CHARGING STATION","Normal","9270 CHESAPEAKE DR SAN DIEGO, CA 92123","0.0","4/21/2023","5/31/2030","",""
"CITY","SCP HORTON OWNER 4, LLC","SCP HORTON OWNER 4, LLC","","92101","Agreement","SATELLITE OFFICE","Normal","400 HORTON STE 450, SAN DIEGO, CA 92101","0.0","8/1/2023","7/31/2026","",""
"CITY","SCP PARK SERVICES LLC.A CALIFORNIA LIMITED LIABILTY ","SCP PARK SERVICES LLC.A CALIFORNIA LIMITED LIABILTY ","","92101","Lease","commercial activities ","Normal","900 4th avenue san diego ca 92101","0.0","12/27/2022","12/26/2047","",""
"CITY","WAWANESA GENERAL INSURANCE CO INC","WAWANESA GENERAL INSURANCE CO INC","","92108","Sublease","Office Space","Normal","7650 Mission Valley Rd SD, CA 92108","0.0","8/1/2024","9/30/2028","",""
"E901PM","AMERICAN MESSAGING SERVICES LLC","AMERICAN MESSAGING SERVICES, LLC.","","75057","Permit","USE OF MT. WOODSON ACCESS RD","Held Over","MT WOODSON ACCESS ROAD","0.0","4/11/1994","4/10/2019","",""
"E901PM","AMERICAN TOWERS, INC.","AMERICAN TOWER, INC.","","01801-1053","Lease","COMMUNICATIONS FACILITY","Held Over","MT. WOODSON","0.0","1/12/2006","1/31/2021","PYR","0.0"
"E901PM","NORTH COUNTY DISPATCH JPA","NORTH COUNTY DISPATCH JPA","","92067-1206","License","COMMUNICATIONS EQUIPMENT","Normal","MT.WOODSON","0.0","8/1/2024","7/31/2034","FYD","32259.6"
"E901PM","PACIFIC BELL","AT&T TOWER ASSET GROUP","AT&T SERVICES INC.","30319-5309","Lease","COMMUNICATION EQUIPMENT","Held Over","MT. WOODSON COMMUNICATIONS","0.0","7/1/2001","6/30/2016","FMD","6595.78"
"E901PM","PALOMAR COMMUNICATIONS, INC.","PALOMAR COMMUNICATIONS, INC.","","92029","Lease","O&M COMMUNICATIONS FACILITY","Held Over","MT. WOODSON","0.0","7/31/2007","7/31/2012","FMD","8005.14"
"E901PM","SDG&E","SDG&E","","92123-1569","Permit","MICROWAVE/2 WAY RADIO FACIL.","Held Over","POR MT WOODSON/ HWY 67 RAMONA","0.0","10/1/2009","9/30/2019","FYD","54027.13"
"E901PM","US CUSTOMS & BORDER PROTECTION/04","US CUSTOMS & BORDER PROTECTION/04","","76040","MOU","TELECOM FACILITY","Normal","MT. WOODSON, RAMONA","0.0","10/1/2017","9/30/2037","",""
"E901PM","USA (NWS)","USA (NWS)","","98115-6349","Permit","RADIO TRANSMITTING/RECEIVING","Held Over","MT. WOODSON","0.0","3/1/2018","2/28/2021","FMR","926.09"
"E901RU","CITY OF POWAY","CITY OF POWAY","","92074","Permit","HIKING AND EQUESTRIAN TRAIL","MTM","MT WOODSON","0.0","1/22/2001","1/21/2011","",""
"F502W2","VERIZON WIRELESS NSB BLACK MOUNTAIN RESERVOIR","VERIZON WIRELESS NSB BLACK MOUNTAIN RESERVOIR","","California","License","NSB CARRIER SITE ID - MALER","Pending","14799 Black Mountain Road, San Diego, CA 92129","0.0","7/1/2027","","",""
